item_id,authors,title,venue,year
404980,"['Yusen Zhang 0001', 'Jun Wang 0122', 'Zhiguo Wang', 'Rui Zhang 0037']",XSemPLR: Cross-Lingual Semantic Parsing in Multiple Natural Languages and Meaning Representations.,ACL,2023
404981,"['Meiqi Chen 0001', 'Yixin Cao 0002', 'Yan Zhang', 'Zhiwei Liu']",CHEER: Centrality-aware High-order Event Reasoning Network for Document-level Event Causality Identification.,ACL,2023
404984,"['Dou Hu 0001', 'Yinan Bao', 'Lingwei Wei', 'Wei Zhou 0019', 'Songlin Hu']",Supervised Adversarial Contrastive Learning for Emotion Recognition in Conversations.,ACL,2023
404986,"['Ziqing Yang 0001', 'Yiming Cui', 'Xin Yao', 'Shijin Wang 0001']",Gradient-based Intra-attention Pruning on Pre-trained Language Models.,ACL,2023
404987,"['Shweta Yadav 0001', 'Cornelia Caragea', 'Chenye Zhao', 'Naincy Kumari', 'Marvin Solberg', 'Tanmay Sharma']",Towards Identifying Fine-Grained Depression Symptoms from Memes.,ACL,2023
404992,"['Weinan He 0001', 'Canming Huang', 'Zhanhao Xiao', 'Yongmei Liu 0001']",Exploring the Capacity of Pretrained Language Models for Reasoning about Actions and Change.,ACL,2023
404993,"['Fanghua Ye 0001', 'Zhiyuan Hu', 'Emine Yilmaz']",Modeling User Satisfaction Dynamics in Dialogue via Hawkes Process.,ACL,2023
404996,"['Yulong Chen 0001', 'Yang Liu', 'Ruochen Xu', 'Ziyi Yang', 'Chenguang Zhu 0001', 'Michael Zeng 0001', 'Yue Zhang']",UniSumm and SummZoo: Unified Model and Diverse Benchmark for Few-Shot Summarization.,ACL,2023
404997,"['Yongfeng Huang 0001', 'Yanyang Li', 'Yichong Xu', 'Lin Zhang', 'Ruyi Gan', 'Jiaxing Zhang', 'Liwei Wang']",MVP-Tuning: Multi-View Knowledge Retrieval with Prompt Tuning for Commonsense Reasoning.,ACL,2023
404998,"['Hao Fei 0001', 'Qian Liu 0012', 'Meishan Zhang', 'Min Zhang', 'Tat-Seng Chua']",Scene Graph as Pivoting: Inference-time Image-free Unsupervised Multimodal Machine Translation with Visual Scene Hallucination.,ACL,2023
405000,"['Xinyan Yu 0001', 'Sewon Min', 'Luke Zettlemoyer', 'Hannaneh Hajishirzi']",CREPE: Open-Domain Question Answering with False Presuppositions.,ACL,2023
405001,"['Qiyu Wu 0001', 'Masaaki Nagata', 'Yoshimasa Tsuruoka']",WSPAlign: Word Alignment Pre-training via Large-Scale Weakly Supervised Span Prediction.,ACL,2023
405002,"['Fangyu Liu 0001', 'Francesco Piccinno', 'Syrine Krichene', 'Chenxi Pang', 'Kenton Lee', 'Mandar Joshi', 'Yasemin Altun', 'Nigel Collier', 'Julian Martin Eisenschlos']",MatCha: Enhancing Visual Language Pretraining with Math Reasoning and Chart Derendering.,ACL,2023
405004,"['Yongliang Shen 0001', 'Kaitao Song', 'Xu Tan 0003', 'Dongsheng Li 0002', 'Weiming Lu 0001', 'Yueting Zhuang']",DiffusionNER: Boundary Diffusion for Named Entity Recognition.,ACL,2023
405006,"['Hang Yan 0001', 'Yu Sun', 'Xiaonan Li', 'Yunhua Zhou', 'Xuanjing Huang 0001', 'Xipeng Qiu']",UTC-IE: A Unified Token-pair Classification Architecture for Information Extraction.,ACL,2023
405007,"['Yongliang Shen 0001', 'Zeqi Tan', 'Shuhui Wu', 'Wenqi Zhang', 'Rongsheng Zhang', 'Yadong Xi', 'Weiming Lu 0001', 'Yueting Zhuang']",PromptNER: Prompt Locating and Typing for Named Entity Recognition.,ACL,2023
405010,"['Soumya Sanyal 0001', 'Yichong Xu', 'Shuohang Wang', 'Ziyi Yang', 'Reid Pryzant', 'Wenhao Yu 0002', 'Chenguang Zhu 0001', 'Xiang Ren 0001']",APOLLO: A Simple Approach for Adaptive Pretraining of Language Models for Logical Reasoning.,ACL,2023
405011,"['Yongqi Li 0001', 'Nan Yang 0002', 'Liang Wang', 'Furu Wei', 'Wenjie Li 0002']",Multiview Identifiers Enhanced Generative Retrieval.,ACL,2023
405013,"['Yulong Chen 0001', 'Huajian Zhang', 'Yijie Zhou', 'Xuefeng Bai 0001', 'Yueguan Wang', 'Ming Zhong', 'Jianhao Yan', 'Yafu Li', 'Judy Li', 'Xianchao Zhu', 'Yue Zhang 0004']",Revisiting Cross-Lingual Summarization: A Corpus-based Study and A New Benchmark with Improved Annotation.,ACL,2023
405016,"['Mingqi Gao 0002', 'Xiaojun Wan 0001', 'Jia Su', 'Zhefeng Wang', 'Baoxing Huai']",Reference Matters: Benchmarking Factual Error Correction for Dialogue Summarization with Fine-grained Evaluation Framework.,ACL,2023
405019,"['Uri Shaham 0002', 'Maha Elbayad', 'Vedanuj Goswami', 'Omer Levy', 'Shruti Bhosale']",Causes and Cures for Interference in Multilingual Translation.,ACL,2023
405021,"['Vijay Viswanathan 0002', 'Luyu Gao', 'Tongshuang Wu', 'Pengfei Liu 0003', 'Graham Neubig']",DataFinder: Scientific Dataset Recommendation from Natural Language Descriptions.,ACL,2023
405022,"['Yiyang Li 0002', 'Xinting Huang', 'Wei Bi', 'Hai Zhao 0001']",Pre-training Multi-party Dialogue Models with Latent Discourse Inference.,ACL,2023
405024,"['Xingyao Wang 0002', 'Sha Li', 'Heng Ji']",Code4Struct: Code Generation for Few-Shot Event Structure Prediction.,ACL,2023
405026,"['Kexin Yang 0002', 'Dayiheng Liu', 'Wenqiang Lei', 'Baosong Yang', 'Mingfeng Xue', 'Boxing Chen', 'Jun Xie']",Tailor: A Soft-Prompt-Based Approach to Attribute-Based Controlled Text Generation.,ACL,2023
405027,"['Shiqi Wang 0002', 'Zheng Li', 'Haifeng Qian', 'Chenghao Yang', 'Zijian Wang', 'Mingyue Shang', 'Varun Kumar', 'Samson Tan', 'Baishakhi Ray', 'Parminder Bhatia', 'Ramesh Nallapati', 'Murali Krishna Ramanathan', 'Dan Roth', 'Bing Xiang']",ReCode: Robustness Evaluation of Code Generation Models.,ACL,2023
405028,"['Yun Tang 0002', 'Anna Y. Sun', 'Hirofumi Inaguma', 'Xinyue Chen', 'Ning Dong', 'Xutai Ma', 'Paden Tomasello', 'Juan Pino 0001']",Hybrid Transducer and Attention based Encoder-Decoder Modeling for Speech-to-Text Tasks.,ACL,2023
405032,"['Xuebo Liu 0002', 'Yutong Wang', 'Derek F. Wong', 'Runzhe Zhan', 'Liangxuan Yu', 'Min Zhang 0005']","Revisiting Commonsense Reasoning in Machine Translation: Training, Evaluation and Challenge.",ACL,2023
405033,"['Yiyang Li 0002', 'Hai Zhao 0001']",EM Pre-training for Multi-party Dialogue Response Generation.,ACL,2023
405036,"['Jie Lei 0003', 'Tamara L. Berg', 'Mohit Bansal']",Revealing Single Frame Bias for Video-and-Language Learning.,ACL,2023
405037,"['Zhaowei Wang 0003', 'Quyet V. Do', 'Hongming Zhang 0009', 'Jiayao Zhang 0001', 'Weiqi Wang 0001', 'Tianqing Fang', 'Yangqiu Song', 'Ginny Y. Wong', 'Simon See']",COLA: Contextualized Commonsense Causal Reasoning from the Causal Inference Perspective.,ACL,2023
405038,"['Man Luo 0003', 'Zhiyuan Fang', 'Tejas Gokhale', 'Yezhou Yang', 'Chitta Baral']",End-to-end Knowledge Retrieval with Multi-modal Queries.,ACL,2023
405041,"['Qi Jia 0003', 'Yizhu Liu', 'Haifeng Tang', 'Kenny Q. Zhu']",In-sample Curriculum Learning by Sequence Completion for Natural Language Generation.,ACL,2023
405043,"['Zhiyong Wu 0003', 'Yaoxiang Wang', 'Jiacheng Ye', 'Lingpeng Kong']",Self-Adaptive In-Context Learning: An Information Compression Perspective for In-Context Example Selection and Ordering.,ACL,2023
405045,"['Yan Zeng 0003', 'Wangchunshu Zhou', 'Ao Luo', 'Ziming Cheng', 'Xinsong Zhang']",Cross-View Language Modeling: Towards Unified Cross-Lingual Cross-Modal Pre-training.,ACL,2023
405046,"['Ran Zhou 0004', 'Xin Li 0056', 'Lidong Bing', 'Erik Cambria', 'Chunyan Miao']",Improving Self-training for Cross-lingual Named Entity Recognition with Contrastive and Prototype Learning.,ACL,2023
405048,"['Yuqing Yang 0004', 'Qipeng Guo', 'Xiangkun Hu', 'Yue Zhang', 'Xipeng Qiu', 'Zheng Zhang 0001']",An AMR-based Link Prediction Approach for Document-level Event Argument Extraction.,ACL,2023
405049,"['Yue Zhang 0004', 'Parisa Kordjamshidi']",VLN-Trans: Translator for the Vision and Language Navigation Agent.,ACL,2023
405052,"['Ashish Sharma 0004', 'Kevin Rushton', 'Inna E. Lin', 'David Wadden', 'Khendra G. Lucas', 'Adam S. Miner', 'Theresa Nguyen', 'Tim Althoff']",Cognitive Reframing of Negative Thoughts through Human-Language Model Interaction.,ACL,2023
405055,"['Xiao Xu 0005', 'Bei Li', 'Chenfei Wu', 'Shao-Yen Tseng', 'Anahita Bhiwandiwalla', 'Shachar Rosenman', 'Vasudev Lal', 'Wanxiang Che', 'Nan Duan']",ManagerTower: Aggregating the Insights of Uni-Modal Experts for Vision-Language Representation Learning.,ACL,2023
405059,"['Kun Zhao 0007', 'Bohao Yang', 'Chenghua Lin', 'Wenge Rong', 'Aline Villavicencio', 'Xiaohui Cui']",Evaluating Open-Domain Dialogues in Latent Space with Next Sentence Prediction and Mutual Information.,ACL,2023
405063,"['Chen Xu 0008', 'Xiaoqian Liu', 'Xiaowen Liu', 'Qingxuan Sun', 'Yuhao Zhang', 'Murun Yang', 'Qianqian Dong', 'Tom Ko', 'Mingxuan Wang', 'Tong Xiao', 'Anxiang Ma', 'Jingbo Zhu']",CTC-based Non-autoregressive Speech Translation.,ACL,2023
405069,"['Jun Yan 0012', 'Vansh Gupta', 'Xiang Ren 0001']",BITE: Textual Backdoor Attacks with Iterative Trigger Injection.,ACL,2023
405070,"['Hao Sun 0012', 'Zhexin Zhang', 'Fei Mi', 'Yasheng Wang', 'Wei Liu', 'Jianwei Cui', 'Bin Wang', 'Qun Liu 0001', 'Minlie Huang']",MoralDial: A Framework to Train and Evaluate Moral Dialogue Systems via Moral Discussions.,ACL,2023
405071,"['Hua Lu 0014', 'Siqi Bao', 'Huang He', 'Fan Wang', 'Hua Wu 0003', 'Haifeng Wang 0001']",Towards Boosting the Open-Domain Chatbot with Human Feedback.,ACL,2023
405072,"['Xiao Zhang 0036', 'Heyan Huang', 'Zewen Chi', 'Xian-Ling Mao']",Bridging The Gap: Entailment Fused-T5 for Open-retrieval Conversational Machine Reading Comprehension.,ACL,2023
405073,"['Rui Li 0086', 'Xu Chen', 'Chaozhuo Li 0001', 'Yanming Shen', 'Jianan Zhao 0002', 'Yujing Wang', 'Weihao Han', 'Hao Sun 0015', 'Weiwei Deng', 'Qi Zhang 0066', 'Xing Xie 0001']",To Copy Rather Than Memorize: A Vertical Learning Paradigm for Knowledge Graph Completion.,ACL,2023
405077,"['Mohamed Abdalla', 'Jan Philip Wahle', 'Terry Lima Ruas', 'Aurélie Névéol', 'Fanny Ducel', 'Saif M. Mohammad', 'Karën Fort']",The Elephant in the Room: Analyzing the Presence of Big Tech in Natural Language Processing Research.,ACL,2023
405078,"['Alafate Abulimiti', 'Chloé Clavel', 'Justine Cassell']",How About Kind of Generating Hedges using End-to-End Neural Models?,ACL,2023
405079,"['Griffin Adams', 'Alexander R. Fabbri', 'Faisal Ladhak', 'Noémie Elhadad', 'Kathleen R. McKeown']",Generating EDU Extracts for Plan-Guided Summary Re-Ranking.,ACL,2023
405080,"['Griffin Adams', 'Bichlien Nguyen', 'Jake Smith', 'Yingce Xia', 'Shufang Xie 0003', 'Anna Ostropolets', 'Budhaditya Deb', 'Yuan-Jyue Chen', 'Tristan Naumann', 'Noémie Elhadad']",What are the Desired Characteristics of Calibration Sets? Identifying Correlates on Long Form Scientific Summarization.,ACL,2023
405082,"['Leonard Adolphs', 'Tianyu Gao', 'Jing Xu', 'Kurt Shuster 0001', 'Sainbayar Sukhbaatar', 'Jason Weston']",The CRINGE Loss: Learning what language not to model.,ACL,2023
405086,"['Harsh Agrawal', 'Aditya Mishra', 'Manish Gupta', 'Mausam']",Multimodal Persona Based Generation of Comic Dialogs.,ACL,2023
405090,"['Sina Ahmadi', 'Antonios Anastasopoulos']",Script Normalization for Unconventional Writing of Under-Resourced Languages in Bilingual Communities.,ACL,2023
405092,"['Jaewoo Ahn', 'Yeda Song', 'Sangdoo Yun', 'Gunhee Kim']",MPCHAT: Towards Multimodal Persona-Grounded Conversation.,ACL,2023
405095,"['Xi Ai', 'Bin Fang 0001']",On-the-fly Cross-lingual Masking for Multilingual Pre-training.,ACL,2023
405098,"['Satoshi Akasaki', 'Naoki Yoshinaga 0001', 'Masashi Toyoda']",Early Discovery of Disappearing Entities in Microblogs.,ACL,2023
405099,"['Ibrahim Taha Aksu', 'Min-Yen Kan', 'Nancy F. Chen']",Prompter: Zero-shot Adaptive Prefixes for Dialogue State Tracking Domain Adaptation.,ACL,2023
405100,"['Ekin Akyürek', 'Jacob Andreas']",LexSym: Compositionality as Lexical Symmetry.,ACL,2023
405101,"['Afra Feyza Akyürek', 'Ekin Akyürek', 'Ashwin Kalyan', 'Peter Clark', 'Derry Tanti Wijaya', 'Niket Tandon']",RL4F: Generating Natural Language Feedback with Reinforcement Learning for Repairing Model Outputs.,ACL,2023
405105,['Duygu Altinok'],A Diverse Set of Freely Available Linguistic Resources for Turkish.,ACL,2023
405108,"['Reinald Kim Amplayo', 'Kellie Webster', 'Michael Collins 0001', 'Dipanjan Das 0001', 'Shashi Narayan']",Query Refinement Prompts for Closed-Book Long-Form QA.,ACL,2023
405109,"['Chantal Amrhein', 'Florian Schottmann', 'Rico Sennrich', 'Samuel Läubli']",Exploiting Biased Models to De-bias Text: A Gender-Fair Rewriting Model.,ACL,2023
405110,"['Shengnan An', 'Zeqi Lin', 'Qiang Fu', 'Bei Chen', 'Nanning Zheng 0001', 'Jian-Guang Lou', 'Dongmei Zhang 0001']",How Do In-Context Examples Affect Compositional Generalization?,ACL,2023
405112,"['Gabriel Herman Bernardim Andrade', 'Shuntaro Yada', 'Eiji Aramaki']",Comparative evaluation of boundary-relaxed annotation for Entity Linking performance.,ACL,2023
405118,"['Mario Ezra Aragón', 'Adrián Pastor López-Monroy', 'Luis Gonzalez', 'David E. Losada', 'Manuel Montes']",DisorBERT: A Double Domain Adaptation Model for Detecting Signs of Mental Disorders in Social Media.,ACL,2023
405119,"['Erik Arakelyan', 'Arnav Arora', 'Isabelle Augenstein']",Topic-Guided Sampling For Data-Efficient Multi-Domain Stance Detection.,ACL,2023
405121,"['Yuki Arase', 'Han Bao 0002', 'Sho Yokoi']",Unbalanced Optimal Transport for Unbalanced Word Alignment.,ACL,2023
405124,"['Akshatha Arodi', 'Martin Pömsl', 'Kaheer Suleman', 'Adam Trischler', 'Alexandra Olteanu', 'Jackie Chi Kit Cheung']",The KITMUS Test: Evaluating Knowledge Integration from Multiple Sources.,ACL,2023
405133,"['Ananya B. Sai', 'Tanay Dixit', 'Vignesh Nagarajan', 'Anoop Kunchukuttan', 'Pratyush Kumar', 'Mitesh M. Khapra', 'Raj Dabre']",IndicMT Eval: A Dataset to Meta-Evaluate Machine Translation Metrics for Indian Languages.,ACL,2023
405136,"['Jinheon Baek', 'Alham Fikri Aji', 'Jens Lehmann 0001', 'Sung Ju Hwang']",Direct Fact Retrieval from Knowledge Graphs without Entity Linking.,ACL,2023
405138,"['Haoli Bai', 'Zhiguang Liu', 'Xiaojun Meng', 'Wentao Li', 'Shuang Liu', 'Yifeng Luo', 'Nian Xie', 'Rongfu Zheng', 'Liangwei Wang', 'Lu Hou', 'Jiansheng Wei', 'Xin Jiang 0002', 'Qun Liu 0001']",Wukong-Reader: Multi-modal Pre-training for Fine-grained Visual Document Understanding.,ACL,2023
405139,"['Raphaël Bailly', 'Laurent Leblond', 'Kata Gábor']",Syntax and Geometry of Information.,ACL,2023
405143,"['Parikshit Bansal', 'Amit Sharma 0007']",Controlling Learned Effects to Reduce Spurious Correlations in Text Classifiers.,ACL,2023
405144,"['Hritik Bansal', 'Karthik Gopalakrishnan', 'Saket Dingliwal', 'Sravan Bodapati', 'Katrin Kirchhoff', 'Dan Roth']",Rethinking the Role of Scale for In-Context Learning: An Interpretability-based Case Study at 66 Billion Scale.,ACL,2023
405146,"['Yuwei Bao', 'Barrett Martin Lattimer', 'Joyce Chai']",Human Inspired Progressive Alignment and Comparative Learning for Grounded Word Acquisition.,ACL,2023
405147,"['Guangsheng Bao', 'Zhiyang Teng', 'Yue Zhang 0004']",Target-Side Augmentation for Document-Level Machine Translation.,ACL,2023
405148,"['Jianzhu Bao', 'Rui Wang 0092', 'Yasheng Wang', 'Aixin Sun', 'Yitong Li', 'Fei Mi', 'Ruifeng Xu']",A Synthetic Data Generation Framework for Grounded Dialogues.,ACL,2023
405149,"['Rong Bao', 'Rui Zheng', 'Liang Ding 0006', 'Qi Zhang 0001', 'Dacheng Tao']",CASN: Class-Aware Score Network for Textual Adversarial Detection.,ACL,2023
405154,"['Martijn Bartelds', 'Nay San', 'Bradley McDonnell', 'Dan Jurafsky', 'Martijn Wieling 0001']",Making More of Little Data: Improving Low-Resource Automatic Speech Recognition Using Data Augmentation.,ACL,2023
405159,"['Mohaddeseh Bastan', 'Mihai Surdeanu', 'Niranjan Balasubramanian']",NEUROSTRUCTURAL DECODING: Neural Text Generation with Structural Constraints.,ACL,2023
405162,"['Björn Bebensee', 'Haejun Lee']",Span-Selective Linear Attention Transformers for Effective and Robust Schema-Guided Dialogue State Tracking.,ACL,2023
405163,"['Shabnam Behzad', 'Keisuke Sakaguchi', 'Nathan Schneider 0001', 'Amir Zeldes']",ELQA: A Corpus of Metalinguistic Questions and Answers about English.,ACL,2023
405165,"['Jonas Belouadi', 'Steffen Eger']",ByGPT5: End-to-End Style-conditioned Poetry Generation with Token-free Language Models.,ACL,2023
405171,"['Chandra Bhagavatula', 'Jena D. Hwang', 'Doug Downey', 'Ronan Le Bras 0001', 'Ximing Lu', 'Lianhui Qin', 'Keisuke Sakaguchi', 'Swabha Swayamdipta', 'Peter West', 'Yejin Choi 0001']",I2D2: Inductive Knowledge Distillation with NeuroLogic and Self-Imitation.,ACL,2023
405179,"['Abhik Bhattacharjee', 'Tahmid Hasan', 'Wasi Uddin Ahmad', 'Yuan-Fang Li', 'Yong-Bin Kang', 'Rifat Shahriyar']","CrossSum: Beyond English-Centric Cross-Lingual Summarization for 1, 500+ Language Pairs.",ACL,2023
405181,"['Satwik Bhattamishra', 'Arkil Patel', 'Varun Kanade', 'Phil Blunsom']",Simplicity Bias in Transformers and their Ability to Learn Sparse Boolean Functions.,ACL,2023
405182,"['Guanqun Bi', 'Lei Shen', 'Yanan Cao', 'Meng Chen 0006', 'Yuqiang Xie', 'Zheng Lin 0001', 'Xiaodong He 0001']",DiffusEmp: A Diffusion Model-Based Framework with Multi-Grained Control for Empathetic Response Generation.,ACL,2023
405184,"['Terra Blevins', 'Hila Gonen', 'Luke Zettlemoyer']",Prompting Language Models for Linguistic Structure.,ACL,2023
405185,"['Sofia Blinova', 'Xinyu Zhou', 'Martin Jaggi', 'Carsten Eickhoff', 'Seyed Ali Bahrainian']",SIMSUM: Document-level Text Simplification via Simultaneous Summarization.,ACL,2023
405186,"['Valeria Bolotova-Baranova', 'Vladislav Blinov', 'Sofya Filippova', 'Falk Scholer', 'Mark Sanderson']",WikiHowQA: A Comprehensive Benchmark for Multi-Document Non-Factoid Question Answering.,ACL,2023
405189,"['Nadav Borenstein', 'Natalia da Silva Perez', 'Isabelle Augenstein']",Multilingual Event Extraction from Historical Newspaper Adverts.,ACL,2023
405192,"['Eleftheria Briakou', 'Colin Cherry', 'George F. Foster']",Searching for Needles in a Haystack: On the Role of Incidental Bilingualism in PaLM&apos;s Translation Capability.,ACL,2023
405197,"['Emanuele Bugliarello', 'Laurent Sartran', 'Aishwarya Agrawal', 'Lisa Anne Hendricks', 'Aida Nematzadeh']",Measuring Progress in Fine-grained Vision-and-Language Understanding.,ACL,2023
405200,"['Alexandra Butoi', 'Ryan Cotterell', 'David Chiang 0001']",Convergence and Diversity in the Control Hierarchy.,ACL,2023
405201,"['Pere-Lluís Huguet Cabot', 'Simone Tedeschi', 'Axel-Cyrille Ngonga Ngomo', 'Roberto Navigli']",REDFM: a Filtered and Multilingual Relation Extraction Dataset.,ACL,2023
405203,"['Avi Caciularu', 'Matthew E. Peters', 'Jacob Goldberger', 'Ido Dagan', 'Arman Cohan']",Peek Across: Improving Multi-Document Modeling via Cross-Document Question-Answering.,ACL,2023
405206,"['Mingzhu Cai', 'Siqi Bao', 'Xin Tian', 'Huang He', 'Fan Wang', 'Hua Wu 0003']",Query Enhanced Knowledge-Intensive Conversation via Unsupervised Joint Modeling.,ACL,2023
405208,"['Pengshan Cai', 'Kaiqiang Song', 'Sangwoo Cho', 'Hongwei Wang 0010', 'Xiaoyang Wang', 'Hong Yu 0001', 'Fei Liu 0004', 'Dong Yu 0001']",Generating User-Engaging News Headlines.,ACL,2023
405211,"['Nitay Calderon', 'Subhabrata Mukherjee', 'Roi Reichart', 'Amir Kantor']",A Systematic Study of Knowledge Distillation for Natural Language Generation with Pseudo-Target Training.,ACL,2023
405214,['Kris Cao'],What is the best recipe for character-level encoder-only modelling?,ACL,2023
405217,"['Qingqing Cao', 'Bhargavi Paranjape', 'Hannaneh Hajishirzi']",PuMer: Pruning and Merging Tokens for Efficient Vision Language Models.,ACL,2023
405218,"['Zhiwei Cao', 'Baosong Yang', 'Huan Lin', 'Suhang Wu', 'Xiangpeng Wei', 'Dayiheng Liu', 'Jun Xie', 'Min Zhang', 'Jinsong Su']",Bridging the Domain Gaps in Context Representations for k-Nearest Neighbor Neural Machine Translation.,ACL,2023
405221,"['Arie Cattan', 'Lilach Eden', 'Yoav Kantor', 'Roy Bar-Haim']",From Key Points to Key Point Hierarchy: Structured and Expressive Opinion Summarization.,ACL,2023
405223,"['Heyan Chai', 'Jinhao Cui', 'Ye Wang', 'Min Zhang', 'Binxing Fang', 'Qing Liao 0001']",Improving Gradient Trade-offs between Tasks in Multi-task Text Classification.,ACL,2023
405226,"['Mohna Chakraborty', 'Adithya Kulkarni', 'Qi Li 0012']",Zero-shot Approach to Overcome Perturbation Sensitivity of Prompts.,ACL,2023
405227,"['Ilias Chalkidis', 'Nicolas Garneau', 'Catalina Goanta', 'Daniel Martin Katz', 'Anders Søgaard']",LeXFiles and LegalLAMA: Facilitating English Multinational Legal Language Model Development.,ACL,2023
405231,"['Jun Shern Chan', 'Michael Pieler', 'Jonathan Jao', 'Jérémy Scheurer', 'Ethan Perez']",Few-shot Adaptation Works with UnpredicTable Data.,ACL,2023
405232,"['Sachin Chanchani', 'Ruihong Huang']",Composition-contrastive Learning for Sentence Embeddings.,ACL,2023
405234,"['Tyler A. Chang', 'Kishaloy Halder', 'Neha Anna John', 'Yogarshi Vyas', 'Yassine Benajiba', 'Miguel Ballesteros', 'Dan Roth']",Characterizing and Measuring Linguistic Dataset Drift.,ACL,2023
405235,"['Ting-Yun Chang', 'Robin Jia']",Data Curation Alone Can Stabilize In-context Learning.,ACL,2023
405237,"['Haw-Shiuan Chang', 'Ruei-Yao Sun', 'Kathryn Ricci', 'Andrew McCallum']",Multi-CLS BERT: An Efficient Alternative to Traditional Ensembling.,ACL,2023
405239,"['Subhajit Chaudhury', 'Sarathkrishna Swaminathan', 'Daiki Kimura', 'Prithviraj Sen', 'Keerthiram Murugesan', 'Rosario Uceda-Sosa', 'Michiaki Tatsubori', 'Achille Fokoue', 'Pavan Kapanipathi', 'Asim Munawar', 'Alexander Gray']",Learning Symbolic Rules over Abstract Meaning Representations for Textual Reinforcement Learning.,ACL,2023
405242,"['Jiawei Chen 0011', 'Yaojie Lu 0001', 'Hongyu Lin', 'Jie Lou', 'Wei Jia', 'Dai Dai', 'Hua Wu 0003', 'Boxi Cao', 'Xianpei Han', 'Le Sun 0001']",Learning In-context Learning for Named Entity Recognition.,ACL,2023
405244,"['Hanjie Chen', 'Faeze Brahman', 'Xiang Ren 0001', 'Yangfeng Ji', 'Yejin Choi 0001', 'Swabha Swayamdipta']",REV: Information-Theoretic Evaluation of Free-Text Rationales.,ACL,2023
405247,"['Xuxi Chen', 'Tianlong Chen', 'Weizhu Chen', 'Ahmed Hassan Awadallah', 'Zhangyang Wang', 'Yu Cheng 0001']",DSEE: Dually Sparsity-embedded Efficient Tuning of Pre-trained Language Models.,ACL,2023
405250,"['Yiming Chen', 'Simin Chen', 'Zexin Li 0001', 'Wei Yang 0013', 'Cong Liu 0005', 'Robby T. Tan', 'Haizhou Li 0001']",Dynamic Transformers Provide a False Sense of Efficiency.,ACL,2023
405252,"['Haotian Chen', 'Bingsheng Chen', 'Xiangdong Zhou']",Did the Models Understand Documents? Benchmarking Models for Language Understanding in Document-Level Relation Extraction.,ACL,2023
405253,"['Mingda Chen', 'Paul-Ambroise Duquenne', 'Pierre Andrews', 'Justine Kao', 'Alexandre Mourachko', 'Holger Schwenk', 'Marta R. Costa-jussà']",BLASER: A Text-Free Speech-to-Speech Translation Evaluation Metric.,ACL,2023
405254,"['Yulin Chen', 'Ning Ding 0002', 'Xiaobin Wang', 'Shengding Hu', 'Haitao Zheng 0002', 'Zhiyuan Liu 0001', 'Pengjun Xie']",Exploring Lottery Prompts for Pre-trained Language Models.,ACL,2023
405256,"['Jingyi Chen', 'Micha Elsner']",Exploring How Generative Adversarial Networks Learn Phonological Representations.,ACL,2023
405257,"['Zhibin Chen', 'Yansong Feng', 'Dongyan Zhao 0001']","From the One, Judge of the Whole: Typed Entailment Graph Construction with Predicate Generation.",ACL,2023
405258,"['Zeming Chen', 'Qiyue Gao', 'Antoine Bosselut', 'Ashish Sabharwal', 'Kyle Richardson 0001']",DISCO: Distilling Counterfactuals with Large Language Models.,ACL,2023
405260,"['Ziwei Chen', 'Linmei Hu', 'Weixin Li 0001', 'Yingxia Shao', 'Liqiang Nie']",Causal Intervention and Counterfactual Reasoning for Multi-modal Fake News Detection.,ACL,2023
405261,"['Guanhua Chen', 'Lu Hou', 'Yun Chen', 'Wenliang Dai', 'Lifeng Shang', 'Xin Jiang', 'Qun Liu', 'Jia Pan', 'Wenping Wang']",mCLIP: Multilingual CLIP via Cross-lingual Transfer.,ACL,2023
405263,"['Chih-Yao Chen', 'Tun-Min Hung', 'Yi-Li Hsu', 'Lun-Wei Ku']",Label-Aware Hyperbolic Embeddings for Fine-grained Emotion Classification.,ACL,2023
405267,"['Leiyuan Chen', 'Chengsong Huang', 'Xiaoqing Zheng', 'Jinshu Lin', 'Xuanjing Huang 0001']",TableVLM: Multi-modal Pre-training for Table Structure Recognition.,ACL,2023
405269,"['Ziyang Chen', 'Jinzhi Liao', 'Xiang Zhao 0002']",Multi-granularity Temporal Question Answering over Knowledge Graphs.,ACL,2023
405270,"['Yuan Chen', 'Xia Li']",PMAES: Prompt-mapping Contrastive Learning for Cross-prompt Automated Essay Scoring.,ACL,2023
405272,"['Chi Chen 0005', 'Peng Li 0030', 'Maosong Sun 0001', 'Yang Liu 0005']",Weakly Supervised Vision-and-Language Pre-training with Relative Representations.,ACL,2023
405273,"['Xiuying Chen', 'Guodong Long', 'Chongyang Tao', 'Mingzhe Li', 'Xin Gao 0001', 'Chengqi Zhang', 'Xiangliang Zhang 0001']",Improving the Robustness of Summarization Systems with Dual Augmentation.,ACL,2023
405275,"['Hegang Chen', 'Pengbo Mao', 'Yuyin Lu', 'Yanghui Rao']",Nonlinear Structural Equation Model Guided Gaussian Mixture Hierarchical Topic Modeling.,ACL,2023
405278,"['Jiangjie Chen', 'Wei Shi', 'Ziquan Fu', 'Sijie Cheng', 'Lei Li 0005', 'Yanghua Xiao']",Say What You Mean! Large Language Models Speak Too Positively about Negative Commonsense Knowledge.,ACL,2023
405280,"['Nuo Chen 0001', 'Linjun Shou', 'Jian Pei', 'Ming Gong', 'Bowen Cao', 'Jianhui Chang', 'Jia Li 0009', 'Daxin Jiang']",Alleviating Over-smoothing for Unsupervised Sentence Representation.,ACL,2023
405285,"['Xiudi Chen', 'Hui Wu', 'Xiaodong Shi']",Consistent Prototype Learning for Few-Shot Continual Relation Extraction.,ACL,2023
405286,"['Chen Chen', 'Dylan Walker', 'Venkatesh Saligrama']",Ideology Prediction from Scarce and Biased Supervision: Learn to Disregard the &quot;What&quot; and Focus on the &quot;How&quot;!,ACL,2023
405290,"['Yangyi Chen', 'Lifan Yuan', 'Ganqu Cui', 'Zhiyuan Liu 0001', 'Heng Ji']",A Close Look into the Calibration of Pre-trained Language Models.,ACL,2023
405296,"['Myra Cheng', 'Esin Durmus', 'Dan Jurafsky']",Marked Personas: Using Natural Language Prompts to Measure Stereotypes in Language Models.,ACL,2023
405297,"['Xize Cheng', 'Tao Jin', 'Linjun Li', 'Wang Lin', 'Xinyu Duan', 'Zhou Zhao']",OpenSR: Open-Modality Speech Recognition via Maintaining Multi-Modality Alignment.,ACL,2023
