item_id,authors,title,venue,year
406938,"['Qin Zhang', 'Shangsi Chen', 'Dongkuan Xu', 'Qingqing Cao', 'Xiaojun Chen 0006', 'Trevor Cohn', 'Meng Fang']",A Survey for Efficient Open Domain Question Answering.,ACL,2023
406940,"['Jiajie Zhang', 'Shulin Cao', 'Tingjian Zhang', 'Xin Lv', 'Juanzi Li', 'Lei Hou 0001', 'Jiaxin Shi', 'Qi Tian']",Reasoning over Hierarchical Question Decomposition Tree for Explainable Question Answering.,ACL,2023
406947,"['Mike Zhang', 'Rob van der Goot', 'Barbara Plank']",ESCOXLM-R: Multilingual Taxonomy-driven Pre-training for the Job Market Domain.,ACL,2023
406950,"['Zhuo Zhang', 'Xiangjing Hu', 'Jingyuan Zhang', 'Yating Zhang', 'Hui Wang', 'Lizhen Qu', 'Zenglin Xu']",FEDLEGAL: The First Real-World Federated Learning Benchmark for Legal NLP.,ACL,2023
406951,"['Mian Zhang', 'Lifeng Jin', 'Linfeng Song', 'Haitao Mi', 'Wenliang Chen', 'Dong Yu 0001']",SafeConv: Explaining and Correcting Conversational Unsafe Behavior.,ACL,2023
406954,"['Ruoyu Zhang', 'Yanzeng Li', 'Lei Zou 0001']",A Novel Table-to-Graph Generation Approach for Document-Level Joint Entity and Relation Extraction.,ACL,2023
406956,"['Xiaoheng Zhang', 'Yang Li']",A Cross-Modality Context Fusion and Semantic Refinement Network for Emotion Recognition in Conversation.,ACL,2023
406959,"['Tianshu Zhang', 'Changchang Liu', 'Wei-Han Lee', 'Yu Su 0001', 'Huan Sun 0001']","Federated Learning for Semantic Parsing: Task Formulation, Evaluation Setup, New Algorithms.",ACL,2023
406960,"['Xilong Zhang', 'Ruochen Liu', 'Jin Liu', 'Xuefeng Liang']",Interpreting Positional Information in Perspective of Word Order.,ACL,2023
406961,"['Kechi Zhang', 'Zhuo Li', 'Jia Li 0011', 'Ge Li', 'Zhi Jin']",Self-Edit: Fault-Aware Code Editor for Code Generation.,ACL,2023
406963,"['Zhong Zhang 0004', 'Bang Liu', 'Junming Shao']",Fine-tuning Happens in Tiny Subspaces: Exploring Intrinsic Task-specific Subspaces of Pre-trained Language Models.,ACL,2023
406964,"['Yuanchi Zhang', 'Peng Li 0030', 'Maosong Sun 0001', 'Yang Liu 0005']",Continual Knowledge Distillation for Neural Machine Translation.,ACL,2023
406966,"['Songming Zhang', 'Yunlong Liang', 'Shuaibo Wang', 'Yufeng Chen 0005', 'Wenjuan Han', 'Jian Liu 0032', 'Jinan Xu']",Towards Understanding and Improving Knowledge Distillation for Neural Machine Translation.,ACL,2023
406969,"['Lining Zhang', 'Simon Mille', 'Yufang Hou 0001', 'Daniel Deutsch', 'Elizabeth Clark', 'Yixin Liu', 'Saad Mahamood', 'Sebastian Gehrmann', 'Miruna Clinciu', 'Khyathi Raghavi Chandu', 'João Sedoc']",A Needle in a Haystack: An Analysis of High-Agreement Workers on MTurk for Summarization.,ACL,2023
406974,"['Kaihang Zhang', 'Kai Shuang', 'Xinyue Yang', 'Xuyang Yao', 'Jinyu Guo']",What Is Overlap Knowledge in Event Argument Extraction? APE: A Cross-datasets Transfer Learning Model for EAE.,ACL,2023
406975,"['Zhenyu Zhang', 'Lei Shen', 'Yuming Zhao', 'Meng Chen 0006', 'Xiaodong He 0001']",Dialog-Post: Multi-Level Self-Supervised Objectives and Hierarchical Model for Dialogue Post-Training.,ACL,2023
406980,"['Shiyue Zhang', 'David Wan', 'Mohit Bansal']",Extractive is not Faithful: An Investigation of Broad Unfaithfulness Problems in Extractive Summarization.,ACL,2023
406981,"['Zhexin Zhang', 'Jiaxin Wen', 'Minlie Huang']",ETHICIST: Targeted Training Data Extraction Through Loss Smoothed Soft Prompting and Calibrated Confidence Estimation.,ACL,2023
406982,"['Shiyue Zhang', 'Shijie Wu', 'Ozan Irsoy', 'Steven Lu 0003', 'Mohit Bansal', 'Mark Dredze', 'David S. Rosenberg']",MixCE: Training Autoregressive Language Models by Mixing Forward and Reverse Cross-Entropies.,ACL,2023
406984,"['Huaao Zhang', 'Qiang Wang', 'Bo Qin', 'Zelin Shi', 'Haibo Wang', 'Ming Chen']",Understanding and Improving the Robustness of Terminology Constraints in Neural Machine Translation.,ACL,2023
406988,"['Mengqi Zhang', 'Yuwei Xia', 'Qiang Liu 0006', 'Shu Wu', 'Liang Wang 0001']",Learning Latent Relations for Temporal Knowledge Graph Reasoning.,ACL,2023
406993,"['Chen Zhang', 'Yang Yang', 'Jiahao Liu', 'Jingang Wang', 'Yunsen Xian', 'Benyou Wang', 'Dawei Song 0001']",Lifting the Curse of Capacity Gap in Distilling Language Models.,ACL,2023
406998,"['Mao Zhang', 'Yongxin Zhu', 'Zhen Liu', 'Zhimin Bao', 'Yunfei Wu', 'Xing Sun', 'Linli Xu']",Span-level Aspect-based Sentiment Analysis via Table Filling.,ACL,2023
406999,"['Zhengyan Zhang', 'Zhiyuan Zeng', 'Yankai Lin', 'Huadong Wang', 'Deming Ye', 'Chaojun Xiao', 'Xu Han 0007', 'Zhiyuan Liu 0001', 'Peng Li 0030', 'Maosong Sun 0001', 'Jie Zhou 0016']",Plug-and-Play Knowledge Injection for Pre-trained Language Models.,ACL,2023
407002,"['Lingxi Zhang', 'Jing Zhang 0001', 'Yanling Wang', 'Shulin Cao', 'Xinmei Huang', 'Cuiping Li', 'Hong Chen 0001', 'Juanzi Li']",FC-KBQA: A Fine-to-Coarse Composition Framework for Knowledge Base Question Answering.,ACL,2023
407004,"['Yu Zhao', 'Hao Fei 0001', 'Wei Ji 0008', 'Jianguo Wei', 'Meishan Zhang', 'Min Zhang', 'Tat-Seng Chua']",Generating Visual Spatial Description via Holistic 3D Scene Understanding.,ACL,2023
407005,"['Zhixue Zhao', 'Nikolaos Aletras']",Incorporating Attribution Importance for Improving Faithfulness Metrics.,ACL,2023
407006,"['Wenting Zhao', 'Justin T. Chiu', 'Claire Cardie', 'Alexander M. Rush']",Abductive Commonsense Reasoning Exploiting Mutually Exclusive Explanations.,ACL,2023
407007,"['Wenzheng Zhao', 'Yuanning Cui', 'Wei Hu']",Improving Continual Relation Extraction by Distinguishing Analogous Semantics.,ACL,2023
407010,"['Jiaxu Zhao 0002', 'Meng Fang', 'Zijing Shi', 'Yitong Li', 'Ling Chen 0006', 'Mykola Pechenizkiy']",CHBias: Bias Evaluation and Mitigation of Chinese Conversational Language Models.,ACL,2023
407011,"['Haodong Zhao', 'Ruifang He', 'Mengnan Xiao', 'Jing Xu']",Infusing Hierarchical Guidance into Prompt Tuning: A Parameter-Efficient Framework for Multi-level Implicit Discourse Relation Recognition.,ACL,2023
407013,"['Ziwang Zhao', 'Linmei Hu', 'Hanyu Zhao', 'Yingxia Shao', 'Yequan Wang']",Knowledgeable Parameter Efficient Tuning Network for Commonsense Question Answering.,ACL,2023
407014,"['Chenye Zhao', 'Yingjie Li 0008', 'Cornelia Caragea']",C-STANCE: A Large Dataset for Chinese Zero-Shot Stance Detection.,ACL,2023
407016,"['Ruochen Zhao', 'Xingxuan Li', 'Shafiq Joty', 'Chengwei Qin', 'Lidong Bing']",Verify-and-Edit: A Knowledge-Enhanced Chain-of-Thought Framework.,ACL,2023
407020,"['Xuandong Zhao', 'Siqi Ouyang', 'Zhiguo Yu', 'Ming Wu', 'Lei Li 0005']",Pre-trained Language Models Can be Fully Zero-Shot Learners.,ACL,2023
407024,"['Yilun Zhao 0001', 'Chen Zhao', 'Linyong Nan', 'Zhenting Qi', 'Wenlin Zhang', 'Xiangru Tang', 'Boyu Mi', 'Dragomir Radev']",RobuT: A Systematic Study of Table QA Robustness Against Human-Annotated Adversarial Perturbations.,ACL,2023
407026,"['Jun Zhao 0019', 'Yongxin Zhang', 'Qi Zhang 0001', 'Tao Gui', 'Zhongyu Wei', 'Minlong Peng', 'Mingming Sun']",Actively Supervised Clustering for Open Relation Extraction.,ACL,2023
407027,"['Jun Zhao 0019', 'Xin Zhao', 'WenYu Zhan', 'Qi Zhang 0001', 'Tao Gui', 'Zhongyu Wei', 'Yun Wen Chen', 'Xiang Gao', 'Xuanjing Huang 0001']",Open Set Relation Extraction via Unknown-Aware Training.,ACL,2023
407028,"['Jun Zhao 0019', 'WenYu Zhan', 'Xin Zhao', 'Qi Zhang 0001', 'Tao Gui', 'Zhongyu Wei', 'Junzhe Wang', 'Minlong Peng', 'Mingming Sun']",RE-Matching: A Fine-Grained Semantic Matching Method for Zero-Shot Relation Extraction.,ACL,2023
407032,"['Changmeng Zheng', 'Junhao Feng', 'Yi Cai', 'Xiaoyong Wei', 'Qing Li 0001']",Rethinking Multimodal Entity and Relation Extraction from a Translation Point of View.,ACL,2023
407033,"['Minghang Zheng', 'Shaogang Gong', 'Hailin Jin', 'Yuxin Peng', 'Yang Liu 0105']",Generating Structured Pseudo Labels for Noise-resistant Zero-shot Video Sentence Localization.,ACL,2023
407034,"['Mingyu Zheng', 'Yang Hao', 'Wenbin Jiang', 'Zheng Lin', 'Yajuan Lyu', 'Qiaoqiao She', 'Weiping Wang']",IM-TQA: A Chinese Table Question Answering Dataset with Implicit and Multi-type Table Structures.,ACL,2023
407035,"['Xiaolin Zheng', 'Mengling Hu', 'Weiming Liu 0005', 'Chaochao Chen 0001', 'Xinting Liao']",Robust Representation Learning with Reliable Pseudo-labels Generation via Self-Adaptive Optimal Transport for Short Text Clustering.,ACL,2023
407036,"['Yandan Zheng', 'Anran Hao', 'Anh Tuan Luu']",Jointprop: Joint Semi-supervised Learning for Entity and Relation Extraction with Heterogeneous Graph-based Propagation.,ACL,2023
407039,"['Wen Zheng', 'Natasa Milic-Frayling', 'Ke Zhou 0003']",Contextual Knowledge Learning for Dialogue Generation.,ACL,2023
407040,"['Junhao Zheng', 'Qianli Ma 0001', 'Shengjie Qiu', 'Yue Wu', 'Peitian Ma', 'Junlong Liu', 'Huawen Feng', 'Xichen Shang', 'Haibin Chen']",Preserving Commonsense Knowledge from Pre-trained Language Models via Causal Inference.,ACL,2023
407041,"['Carolina Zheng', 'Claudia Shi', 'Keyon Vafa', 'Amir Feder', 'David M. Blei']",An Invariant Learning Characterization of Controlled Text Generation.,ACL,2023
407045,"['Wenjie Zheng', 'Jianfei Yu', 'Rui Xia', 'Shijin Wang']",A Facial Expression-Aware Multimodal Multi-task Learning Framework for Emotion Recognition in Multi-party Conversations.,ACL,2023
407046,"['Zi&apos;ou Zheng', 'Xiaodan Zhu 0001']",NatLogAttack: A Framework for Attacking Natural Language Inference Models with Natural Logic.,ACL,2023
407050,"['Qihuang Zhong', 'Liang Ding 0006', 'Juhua Liu', 'Xuebo Liu 0002', 'Min Zhang 0005', 'Bo Du 0001', 'Dacheng Tao']",Revisiting Token Dropping Strategy in Efficient BERT Pretraining.,ACL,2023
407057,"['Wenxuan Zhou', 'Sheng Zhang 0012', 'Tristan Naumann', 'Muhao Chen', 'Hoifung Poon']",Continual Contrastive Finetuning Improves Low-Resource Relation Extraction.,ACL,2023
407058,"['Jinfeng Zhou', 'Zhuang Chen 0002', 'Bo Wang', 'Minlie Huang']",Facilitating Multi-turn Emotional Support Conversation with Positive Emotion Elicitation: A Reinforcement Learning Approach.,ACL,2023
407060,"['Yan Zhou', 'Qingkai Fang', 'Yang Feng 0004']",CMOT: Cross-modal Mixup via Optimal Transport for Speech Translation.,ACL,2023
407065,"['Yu Zhou 0030', 'Sha Li', 'Manling Li', 'Xudong Lin 0003', 'Shih-Fu Chang', 'Mohit Bansal', 'Heng Ji']",Non-Sequential Graph Script Induction via Multimedia Grounding.,ACL,2023
407070,"['Fan Zhou 0002', 'Yuzhou Mao', 'Liu Yu 0001', 'Yi Yang 0042', 'Ting Zhong']",Causal-Debias: Unifying Debiasing in Pretrained Language Models and Fine-tuning via Causal Invariant Learning.,ACL,2023
407072,"['Junkai Zhou', 'Liang Pang', 'Huawei Shen', 'Xueqi Cheng']",SimOAP: Improve Coherence and Consistency in Persona-based Dialogue Generation via Over-sampling and Post-evaluation.,ACL,2023
407074,"['Yunhua Zhou', 'Guofeng Quan', 'Xipeng Qiu']",A Probabilistic Framework for Discovering New Intents.,ACL,2023
407076,"['Qinhong Zhou', 'Zonghan Yang', 'Peng Li 0030', 'Yang Liu 0005']",Bridging the Gap between Decision and Logits in Decision-based Knowledge Distillation for Pre-trained Language Models.,ACL,2023
407077,"['Yunhua Zhou', 'Jianqiang Yang', 'Pengyu Wang', 'Xipeng Qiu']",Two Birds One Stone: Dynamic Ensemble for OOD Intent Classification.,ACL,2023
407078,"['Jianing Zhou', 'Ziheng Zeng', 'Suma Bhat']",CLCL: Non-compositional Expression Detection with Contrastive Learning and Curriculum Learning.,ACL,2023
407079,"['Pei Zhou', 'Andrew Zhu', 'Jennifer Hu', 'Jay Pujara', 'Xiang Ren 0001', 'Chris Callison-Burch', 'Yejin Choi 0001', 'Prithviraj Ammanabrolu']",I Cast Detect Thoughts: Learning to Converse and Guide with Intents and Theory-of-Mind in Dungeons and Dragons.,ACL,2023
407081,"['Yangqiaoyu Zhou', 'Yiming Zhang', 'Chenhao Tan']",FLamE: Few-shot Learning from Natural Language Explanations.,ACL,2023
407082,"['Jinfeng Zhou', 'Chujie Zheng', 'Bo Wang 0011', 'Zheng Zhang 0020', 'Minlie Huang']",CASE: Aligning Coarse-to-Fine Cognition and Affection for Empathetic Response Generation.,ACL,2023
407084,"['Rongxin Zhu', 'Jianzhong Qi 0001', 'Jey Han Lau']",Annotating and Detecting Fine-grained Factual Errors for Dialogue Summarization.,ACL,2023
407085,"['Luyao Zhu', 'Wei Li 0076', 'Rui Mao 0010', 'Vlad Pandelea', 'Erik Cambria']",PAED: Zero-Shot Persona Attribute Extraction in Dialogues.,ACL,2023
407086,"['Dawei Zhu', 'Xiaoyu Shen 0001', 'Marius Mosbach', 'Andreas Stephan', 'Dietrich Klakow']",Weaker Than You Think: A Critical Look at Weakly Supervised Learning.,ACL,2023
407087,"['Andrew Zhu', 'Karmanya Aggarwal', 'Alexander H. Feng', 'Lara J. Martin', 'Chris Callison-Burch']",FIREBALL: A Dataset of Dungeons and Dragons Actual-Play with Structured Game State Information.,ACL,2023
407088,"['Dele Zhu', 'Vera Czehmann', 'Eleftherios Avramidis']",Neural Machine Translation Methods for Translating Text to Sign Language Glosses.,ACL,2023
407091,"['Xuekai Zhu', 'Jian Guan 0002', 'Minlie Huang', 'Juan Liu']",StoryTrans: Non-Parallel Story Author-Style Transfer with Discourse Representations and Content Enhancing.,ACL,2023
407094,"['Shaolin Zhu', 'Shangjie Li', 'Yikun Lei', 'Deyi Xiong']",PEIT: Bridging the Modality Gap with Pre-trained Models for End-to-End Image Translation.,ACL,2023
407099,"['Xinyu Zhu', 'Junjie Wang', 'Lin Zhang', 'Yuxiang Zhang', 'Yongfeng Huang 0001', 'Ruyi Gan', 'Jiaxing Zhang', 'Yujiu Yang']",Solving Math Word Problems via Cooperative Reasoning induced Language Models.,ACL,2023
407100,"['Wenhao Zhu', 'Jingjing Xu', 'Shujian Huang', 'Lingpeng Kong', 'Jiajun Chen']",INK: Injecting kNN Knowledge in Nearest Neighbor Machine Translation.,ACL,2023
407103,"['He Zhu', 'Chong Zhang', 'Junjie Huang', 'Junran Wu', 'Ke Xu 0001']",HiTIN: Hierarchy-aware Tree Isomorphism Network for Hierarchical Text Classification.,ACL,2023
407108,"['Yimeng Zhuang', 'Mei Tu']",Pretrained Bidirectional Distillation for Machine Translation.,ACL,2023
407109,"['Wenjie Zhuo', 'Yifan Sun 0003', 'Xiaohan Wang', 'Linchao Zhu', 'Yi Yang 0001']",WhitenedCSE: Whitening-based Contrastive Learning of Sentence Embeddings.,ACL,2023
407111,"['Timon Ziegenbein', 'Shahbaz Syed', 'Felix Lange', 'Martin Potthast', 'Henning Wachsmuth']",Modeling Appropriate Language in Argumentation.,ACL,2023
407113,"['Caleb Ziems', 'Jane Dwivedi-Yu', 'Yi-Chia Wang', 'Alon Y. Halevy', 'Diyi Yang']",NormBank: A Knowledge Bank of Situational Social Norms.,ACL,2023
407114,"['Caleb Ziems', 'William Held', 'Jingfeng Yang', 'Jwala Dhamala', 'Rahul Gupta 0001', 'Diyi Yang']",Multi-VALUE: A Framework for Cross-Dialectal English NLP.,ACL,2023
407117,"['Yicheng Zou', 'Kaitao Song', 'Xu Tan 0003', 'Zhongkai Fu', 'Qi Zhang 0001', 'Dongsheng Li 0002', 'Tao Gui']",Towards Understanding Omission in Dialogue Summarization.,ACL,2023
407118,"['Vilém Zouhar', 'Clara Meister', 'Juan Luis Gastaldi', 'Li Du', 'Mrinmaya Sachan', 'Ryan Cotterell']",Tokenization and the Noiseless Channel.,ACL,2023
407122,"['Iria de-Dios-Flores', 'Juan Garcia Amboage', 'Marcos García 0001']",Dependency resolution at the syntax-semantics interface: psycholinguistic and computational insights on control dependencies.,ACL,2023
594472,"['Anna Rogers', 'Jordan L. Boyd-Graber', 'Naoaki Okazaki']","Proceedings of the 61st Annual Meeting of the Association for Computational Linguistics (Volume 1: Long Papers), ACL 2023, Toronto, Canada, July 9-14, 2023.",ACL,2023
441428,"['Ali Hassani 0001', 'Steven Walton 0001', 'Jiachen Li 0003', 'Shen Li', 'Humphrey Shi']",Neighborhood Attention Transformer.,CVPR,2023
441429,"['Zhibo Wang 0001', 'He Wang 0005', 'Shuaifan Jin', 'Wenwen Zhang', 'Jiahui Hu', 'Yan Wang', 'Peng Sun 0003', 'Wei Yuan', 'Kaixin Liu', 'Kui Ren 0001']",Privacy-preserving Adversarial Facial Features.,CVPR,2023
441430,"['Vinoj Jayasundara 0001', 'Amit Agrawal', 'Nicolas Heron', 'Abhinav Shrivastava', 'Larry S. Davis']",FlexNeRF: Photorealistic Free-viewpoint Rendering of Moving Humans from Sparse Views.,CVPR,2023
441431,"['Seung Wook Kim 0001', 'Bradley Brown', 'Kangxue Yin', 'Karsten Kreis', 'Katja Schwarz', 'Daiqing Li', 'Robin Rombach', 'Antonio Torralba 0001', 'Sanja Fidler']",NeuralField-LDM: Scene Generation with Hierarchical Latent Diffusion Models.,CVPR,2023
441432,"['Yu-Lun Liu 0001', 'Chen Gao', 'Andreas Meuleman', 'Hung-Yu Tseng', 'Ayush Saraf', 'Changil Kim 0001', 'Yung-Yu Chuang', 'Johannes Kopf 0001', 'Jia-Bin Huang 0001']",Robust Dynamic Radiance Fields.,CVPR,2023
441433,"['Yihao Liu 0001', 'Jingwen He', 'Jinjin Gu', 'Xiangtao Kong', 'Yu Qiao 0001', 'Chao Dong']",DegAE: A New Pretraining Paradigm for Low-Level Vision.,CVPR,2023
441434,"['Bowen Cai 0001', 'Jinchi Huang', 'Rongfei Jia', 'Chengfei Lv', 'Huan Fu']",NeuDA: Neural Deformable Anchor for High-Fidelity Implicit Surface Reconstruction.,CVPR,2023
441435,"['Yubin Hu 0001', 'Yuze He', 'Yanghao Li', 'Jisheng Li', 'Yuxing Han 0001', 'Jiangtao Wen', 'Yong-Jin Liu']",Efficient Semantic Segmentation by Altering Resolutions for Compressed Videos.,CVPR,2023
441436,"['Yifan Jiang 0001', 'Peter Hedman', 'Ben Mildenhall', 'Dejia Xu', 'Jonathan T. Barron', 'Zhangyang Wang', 'Tianfan Xue']",AligNeRF: High-Fidelity Neural Radiance Fields via Alignment-Aware Training.,CVPR,2023
441437,"['Yuxiang Wei 0001', 'Zhilong Ji', 'Xiaohe Wu', 'Jinfeng Bai', 'Lei Zhang 0033', 'Wangmeng Zuo']",Inferring and Leveraging Parts from Object Shape for Improving Semantic Image Synthesis.,CVPR,2023
441438,"['Zaid Khan 0001', 'B. G. Vijay Kumar', 'Samuel Schulter', 'Xiang Yu 0002', 'Yun Fu 0001', 'Manmohan Chandraker']",Q: How to Specialize Large Vision-Language Models to Data-Scarce VQA Tasks? A: Self-Train on Unlabeled Images!,CVPR,2023
441439,"['Luting Wang 0001', 'Yi Liu', 'Penghui Du', 'Zihan Ding', 'Yue Liao', 'Qiaosong Qi', 'Biaolong Chen', 'Si Liu 0001']",Object-Aware Distillation Pyramid for Open-Vocabulary Object Detection.,CVPR,2023
441440,"['Jiaming Zhang 0001', 'Ruiping Liu', 'Hao Shi', 'Kailun Yang 0001', 'Simon Reiß', 'Kunyu Peng', 'Haodong Fu', 'Kaiwei Wang', 'Rainer Stiefelhagen']",Delivering Arbitrary-Modal Semantic Segmentation.,CVPR,2023
441441,"['Hongwen Zhang 0001', 'Siyou Lin', 'Ruizhi Shao', 'Yuxiang Zhang 0006', 'Zerong Zheng', 'Han Huang 0005', 'Yandong Guo', 'Yebin Liu']",CloSET: Modeling Clothed Humans on Continuous Surface with Explicit Template Decomposition.,CVPR,2023
441442,"['Zhicheng Sun 0001', 'Yadong Mu', 'Gang Hua 0001']",Regularizing Second-Order Influences for Continual Learning.,CVPR,2023
441443,"['Ilya A. Petrov 0001', 'Riccardo Marin', 'Julian Chibane', 'Gerard Pons-Moll']",Object pop-up: Can we infer 3D objects and their poses from human interactions alone?,CVPR,2023
441444,"['Yilin Wen 0001', 'Hao Pan 0001', 'Lei Yang 0048', 'Jia Pan', 'Taku Komura', 'Wenping Wang']",Hierarchical Temporal Transformer for 3D Hand Pose Estimation and Action Recognition from Egocentric RGB Videos.,CVPR,2023
441445,"['Minjung Son 0001', 'Jeong Joon Park', 'Leonidas J. Guibas', 'Gordon Wetzstein']",SinGRAF: Learning a 3D Generative Radiance Field for a Single Scene.,CVPR,2023
441446,"['Yue Qiu 0001', 'Yanjun Sun', 'Fumiya Matsuzawa', 'Kenji Iwata', 'Hirokatsu Kataoka']",Graph Representation for Order-aware Visual Transformation.,CVPR,2023
441447,"['Su Wang 0001', 'Chitwan Saharia', 'Ceslee Montgomery', 'Jordi Pont-Tuset', 'Shai Noy', 'Stefano Pellegrini', 'Yasumasa Onoe', 'Sarah Laszlo', 'David J. Fleet', 'Radu Soricut', 'Jason Baldridge', 'Mohammad Norouzi 0002', 'Peter Anderson', 'William Chan']",Imagen Editor and EditBench: Advancing and Evaluating Text-Guided Image Inpainting.,CVPR,2023
441448,"['Yaoyao Liu 0001', 'Bernt Schiele', 'Andrea Vedaldi', 'Christian Rupprecht 0001']",Continual Detection Transformer for Incremental Object Detection.,CVPR,2023
441449,"['Yiqun Wang 0001', 'Ivan Skorokhodov', 'Peter Wonka']",PET-NeuS: Positional Encoding Tri-Planes for Neural Surfaces.,CVPR,2023
441450,"['Yiting Cheng 0001', 'Fangyun Wei', 'Jianmin Bao', 'Dong Chen 0003', 'Wenqiang Zhang']",CiCo: Domain-Aware Sign Language Retrieval via Cross-Lingual Contrastive Learning.,CVPR,2023
441451,"['Lixin Yang 0001', 'Jian Xu', 'Licheng Zhong', 'Xinyu Zhan 0001', 'Zhicheng Wang', 'Kejian Wu', 'Cewu Lu']",POEM: Reconstructing Hand in a Point Embedded Multi-view Stereo.,CVPR,2023
441452,"['Zhibo Wang 0001', 'Hongshan Yang', 'Yunhe Feng', 'Peng Sun 0003', 'Hengchang Guo', 'Zhifei Zhang', 'Kui Ren 0001']",Towards Transferable Targeted Adversarial Examples.,CVPR,2023
441453,"['Tiancheng Lin 0001', 'Zhimiao Yu', 'Hongyu Hu', 'Yi Xu 0001', 'Chang Wen Chen']",Interventional Bag Multi-Instance Learning On Whole-Slide Pathological Images.,CVPR,2023
441454,"['Yaqing Ding 0001', 'Jian Yang 0003', 'Viktor Larsson', 'Carl Olsson', 'Kalle Åström']",Revisiting the P3P Problem.,CVPR,2023
441455,"['Yuesong Wang 0001', 'Zhaojie Zeng', 'Tao Guan', 'Wei Yang 0011', 'Zhuo Chen', 'Wenkai Liu', 'Luoyuan Xu', 'Yawei Luo']",Adaptive Patch Deformation for Textureless-Resilient Multi-View Stereo.,CVPR,2023
441456,"['Qianyu Zhou 0001', 'Ke-Yue Zhang', 'Taiping Yao', 'Xuequan Lu', 'Ran Yi', 'Shouhong Ding', 'Lizhuang Ma']",Instance-Aware Domain Generalization for Face Anti-Spoofing.,CVPR,2023
441457,"['Zhou Yu 0001', 'Lixiang Zheng', 'Zhou Zhao', 'Fei Wu 0001', 'Jianping Fan 0001', 'Kui Ren 0001', 'Jun Yu 0002']",ANetQA: A Large-scale Benchmark for Fine-grained Compositional Reasoning over Untrimmed Videos.,CVPR,2023
441458,"['Seongwon Lee 0002', 'Suhyeon Lee 0002', 'Hongje Seong', 'Euntai Kim']",Revisiting Self-Similarity: Structural Embedding for Image Retrieval.,CVPR,2023
441459,"['Zheng Qin 0002', 'Hao Yu 0010', 'Changjian Wang', 'Yuxing Peng 0001', 'Kai Xu 0004']",Deep Graph-based Spatial Consistency for Robust Non-rigid Point Cloud Registration.,CVPR,2023
441460,"['Zheng Xu 0002', 'Maxwell D. Collins', 'Yuxiao Wang 0001', 'Liviu Panait', 'Sewoong Oh', 'Sean Augenstein', 'Ting Liu 0005', 'Florian Schroff', 'H. Brendan McMahan']",Learning to Generate Image Embeddings with User-Level Differential Privacy.,CVPR,2023
441461,"['Jiawei He 0002', 'Yuntao Chen', 'Naiyan Wang', 'Zhaoxiang Zhang 0001']",3D Video Object Detection with Learnable Object-Centric Global Optimization.,CVPR,2023
441462,"['Simon Weber 0002', 'Nikolaus Demmel', 'Tin Chon Chan', 'Daniel Cremers']",Power Bundle Adjustment for Large-Scale 3D Reconstruction.,CVPR,2023
441463,"['Chenyang Lu 0002', 'Daan de Geus', 'Gijs Dubbelman']",Content-aware Token Sharing for Efficient Semantic Segmentation with Vision Transformers.,CVPR,2023
441464,"['Jongin Lim 0002', 'Youngdong Kim', 'Byungjai Kim', 'Chanho Ahn', 'Jinwoo Shin', 'Eunho Yang', 'Seungju Han']",BiasAdv: Bias-Adversarial Augmentation for Model Debiasing.,CVPR,2023
441465,"['Chen Zhao 0002', 'Shuming Liu', 'Karttikeya Mangalam', 'Bernard Ghanem']",Re2TAL: Rewiring Pretrained Video Backbones for Reversible Temporal Action Localization.,CVPR,2023
441466,"['Junyi Zhu 0002', 'Xingchen Ma', 'Matthew B. Blaschko']",Confidence-Aware Personalized Federated Learning via Variational Expectation Maximization.,CVPR,2023
441467,"['Bin Fan 0002', 'Yuxin Mao', 'Yuchao Dai', 'Zhexiong Wan', 'Qi Liu 0054']",Joint Appearance and Motion Learning for Efficient Rolling Shutter Correction.,CVPR,2023
441468,"['Lingzhi Li 0002', 'Zhen Shen', 'Zhongshu Wang', 'Li Shen 0003', 'Liefeng Bo']",Compressing Volumetric Radiance Fields to 1 MB.,CVPR,2023
441469,"['Shiwei Feng 0002', 'Guanhong Tao 0001', 'Siyuan Cheng 0005', 'Guangyu Shen', 'Xiangzhe Xu', 'Yingqi Liu', 'Kaiyuan Zhang 0002', 'Shiqing Ma', 'Xiangyu Zhang 0001']",Detecting Backdoors in Pre-trained Encoders.,CVPR,2023
441470,"['Kehan Li 0002', 'Zhennan Wang', 'Zesen Cheng', 'Runyi Yu 0002', 'Yian Zhao', 'Guoli Song', 'Chang Liu', 'Li Yuan 0007', 'Jie Chen']",ACSeg: Adaptive Conceptualization for Unsupervised Semantic Segmentation.,CVPR,2023
441471,"['Mingfang Zhang 0002', 'Jinglu Wang', 'Xiao Li', 'Yifei Huang', 'Yoichi Sato', 'Yan Lu 0001']",Structural Multiplane Image: Bridging Neural View Synthesis and 3D Reconstruction.,CVPR,2023
441472,"['Xiaoyang Wu 0002', 'Xin Wen', 'Xihui Liu', 'Hengshuang Zhao']",Masked Scene Contrast: A Scalable Framework for Unsupervised 3D Representation Learning.,CVPR,2023
441473,"['Yuxiao Chen 0002', 'Jianbo Yuan', 'Yu Tian 0003', 'Shijie Geng', 'Xinyu Li', 'Ding Zhou', 'Dimitris N. Metaxas', 'Hongxia Yang']",Revisiting Multimodal Representation in Contrastive Learning: From Patch and Token Embeddings to Finite Discrete Tokens.,CVPR,2023
441474,"['Xiaoming Li 0002', 'Wangmeng Zuo', 'Chen Change Loy']",Learning Generative Structure Prior for Blind Text Image Super-resolution.,CVPR,2023
441475,"['Weijie Su 0002', 'Xizhou Zhu', 'Chenxin Tao', 'Lewei Lu', 'Bin Li 0025', 'Gao Huang', 'Yu Qiao', 'Xiaogang Wang', 'Jie Zhou 0001', 'Jifeng Dai']",Towards All-in-One Pre-Training via Maximizing Multi-Modal Mutual Information.,CVPR,2023
441476,"['Ying Ji 0003', 'Yu Wang 0018', 'Jien Kato']",Spatial-temporal Concept based Explanation of 3D ConvNets.,CVPR,2023
441477,"['Ze Yang 0003', 'Yun Chen 0014', 'Jingkang Wang', 'Sivabalan Manivasagam', 'Wei-Chiu Ma', 'Anqi Joyce Yang', 'Raquel Urtasun']",UniSim: A Neural Closed-Loop Sensor Simulator.,CVPR,2023
441478,"['Lianyu Hu 0003', 'Liqing Gao', 'Zekang Liu', 'Wei Feng 0005']",Continuous Sign Language Recognition with Correlation Network.,CVPR,2023
441479,"['Wenjin Wang 0003', 'Yunqing Hu', 'Qianglong Chen', 'Yin Zhang 0006']",Task Difficulty Aware Parameter Allocation &amp; Regularization for Lifelong Learning.,CVPR,2023
441480,"['Cheng Jiang 0003', 'Xinhai Hou', 'Akhil Kondepudi', 'Asadur Chowdury', 'Christian W. Freudiger', 'Daniel A. Orringer', 'Honglak Lee', 'Todd C. Hollon']",Hierarchical Discriminative Learning Improves Visual Representations of Biomedical Microscopy.,CVPR,2023
441481,"['Jianhua Sun 0003', 'Yuxuan Li', 'Liang Chai', 'Cewu Lu']",Stimulus Verification is a Universal and Effective Sampler in Multi-modal Human Trajectory Prediction.,CVPR,2023
441482,"['Guoqiang Zhang 0003', 'Kenta Niwa', 'W. Bastiaan Kleijn']",Lookahead Diffusion Probabilistic Models for Refining Mean Estimation.,CVPR,2023
