item_id,authors,title,venue,year
442637,"['Hoang M. Le', 'Brian Price', 'Scott Cohen', 'Michael S. Brown']",GamutMLP: A Lightweight MLP for Color Loss Recovery.,CVPR,2023
442638,"['Nhat Le', 'Thang Pham', 'Tuong Do', 'Erman Tjiputra', 'Quang D. Tran', 'Anh Nguyen 0003']",Music-Driven Group Choreography.,CVPR,2023
442640,"['Guillaume Leclerc', 'Andrew Ilyas', 'Logan Engstrom', 'Sung Min Park', 'Hadi Salman', 'Aleksander Madry']",FFCV: Accelerating Training by Removing Data Bottlenecks.,CVPR,2023
442641,"['Sangrok Lee', 'Jongseong Bae', 'Ha Young Kim']","Decompose, Adjust, Compose: Effective Normalization by Playing with Frequency for Domain Generalization.",CVPR,2023
442642,"['Hyundo Lee', 'Inwoo Hwang', 'Hyunsung Go', 'Won-Seok Choi 0006', 'Kibeom Kim', 'Byoung-Tak Zhang']",Learning Geometry-aware Representations by Sketching.,CVPR,2023
442644,"['Yao-Chih Lee', 'Ji-Ze Genevieve Jang', 'Yi-Ting Chen', 'Elizabeth Qiu', 'Jia-Bin Huang 0001']",Shape-Aware Text-Driven Layered Video Editing.,CVPR,2023
442646,"['Hyo-Jun Lee', 'Hanul Kim 0001', 'Su-Min Choi', 'Seong-Gyun Jeong', 'Yeong Jun Koh']",BAAM: Monocular 3D pose and shape reconstruction with bi-contextual attention module and attention-guided modeling.,CVPR,2023
442647,"['Jongmin Lee 0005', 'Byungjin Kim', 'Seungwook Kim 0005', 'Minsu Cho']",Learning Rotation-Equivariant Features for Visual Correspondence.,CVPR,2023
442648,"['Pilhyeon Lee', 'Taeoh Kim', 'Minho Shim', 'Dongyoon Wee', 'Hyeran Byun']",Decomposed Cross-Modal Distillation for RGB-based Temporal Action Detection.,CVPR,2023
442649,"['Chunghwan Lee', 'Jaihoon Kim', 'Chanhyuk Yun', 'Je Hyeong Hong']",Paired-Point Lifting for Enhanced Privacy-Preserving Visual Localization.,CVPR,2023
442650,"['Dongyeun Lee', 'Jae Young Lee', 'Doyeon Kim', 'Jaehyun Choi', 'Jaejun Yoo', 'Junmo Kim 0002']",Fix the Noise: Disentangling Source Feature for Controllable Domain Translation.,CVPR,2023
442651,"['Dogyoon Lee', 'Minhyeok Lee', 'Chajin Shin', 'Sangyoun Lee']",DP-NeRF: Deblurred Neural Radiance Field with Physical Scene Priors.,CVPR,2023
442652,"['Sangjin Lee', 'Hyeongmin Lee', 'Chajin Shin', 'Hanbin Son', 'Sangyoun Lee']",Exploring Discontinuity for Video Frame Interpolation.,CVPR,2023
442656,"['Sohyun Lee', 'Jaesung Rim', 'Boseung Jeong', 'Geonu Kim', 'Byungju Woo', 'Haechan Lee', 'Sunghyun Cho', 'Suha Kwak']",Human Pose Estimation in Extremely Low-Light Conditions.,CVPR,2023
442657,"['Jihyun Lee', 'Minhyuk Sung', 'Honggyu Choi', 'Tae-Kyun Kim']",Im2Hands: Learning Attentive Implicit Representation of Interacting Two-Hand Shapes.,CVPR,2023
442659,"['Taeyeop Lee', 'Jonathan Tremblay', 'Valts Blukis', 'Bowen Wen', 'Byeong-Uk Lee', 'Inkyu Shin', 'Stan Birchfield', 'In So Kweon', 'Kuk-Jin Yoon']",TTA-COPE: Test-Time Adaptation for Category-Level Object Pose Estimation.,CVPR,2023
442660,"['Yi-Lun Lee', 'Yi-Hsuan Tsai', 'Wei-Chen Chiu', 'Chen-Yu Lee']",Multimodal Prompting with Missing Modalities for Visual Recognition.,CVPR,2023
442662,"['Byeong-Uk Lee', 'Jianming Zhang 0001', 'Yannick Hold-Geoffroy', 'In So Kweon']",Single View Scene Scale Estimation using Scale Field.,CVPR,2023
442663,"['Jiahui Lei', 'Congyue Deng', 'Karl Schmeckpeper', 'Leonidas J. Guibas', 'Kostas Daniilidis']",EFEM: Equivariant Neural Field Expectation Maximization for 3D Object Segmentation Without Scene Supervision.,CVPR,2023
442664,"['Jiarui Lei', 'Xiaobo Hu', 'Yue Wang', 'Dong Liu']",PyramidFlow: High-Resolution Defect Contrastive Localization Using Pyramid Normalizing Flow.,CVPR,2023
442665,"['Biwen Lei', 'Jianqiang Ren', 'Mengyang Feng', 'Miaomiao Cui', 'Xuansong Xie']",A Hierarchical Representation Network for Accurate and Detailed Face Reconstruction from In-The-Wild Images.,CVPR,2023
442666,"['Chenyang Lei', 'Xuanchi Ren', 'Zhaoxiang Zhang 0001', 'Qifeng Chen']",Blind Video Deflickering by Neural Filtering with a Flawed Atlas.,CVPR,2023
442667,"['Jiabao Lei', 'Jiapeng Tang', 'Kui Jia']",RGBD2: Generative Scene Synthesis via Incremental View Inpainting Using RGBD Diffusion Models.,CVPR,2023
442668,"['Ted de Vries Lentsch', 'Zimin Xia', 'Holger Caesar', 'Julian F. P. Kooij']",SliceMatch: Geometry-Guided Aggregation for Cross-View Pose Estimation.,CVPR,2023
442669,"['Deborah Levy', 'Amit Peleg', 'Naama Pearl', 'Dan Rosenbaum', 'Derya Akkaynak', 'Simon Korman', 'Tali Treibitz']",SeaThru-NeRF: Neural Radiance Fields in Scattering Media.,CVPR,2023
442670,"['Maria Leyva-Vallina', 'Nicola Strisciuglio', 'Nicolai Petkov']",Data-Efficient Large Scale Place Recognition with Graded Similarity Supervision.,CVPR,2023
442671,"['Zhuoxiao Li', 'Haiyang Jiang 0002', 'Mingdeng Cao', 'Yinqiang Zheng']",Polarized Color Image Denoising.,CVPR,2023
442672,"['Zhaoshuo Li', 'Thomas Müller 0013', 'Alex Evans', 'Russell H. Taylor', 'Mathias Unberath', 'Ming-Yu Liu 0001', 'Chen-Hsuan Lin']",Neuralangelo: High-Fidelity Neural Surface Reconstruction.,CVPR,2023
442673,"['Ruibo Li', 'Hanyu Shi 0002', 'Ziang Fu', 'Zhe Wang', 'Guosheng Lin']",Weakly Supervised Class-agnostic Motion Prediction for Autonomous Driving.,CVPR,2023
442674,"['Jiafeng Li', 'Ying Wen 0003', 'Lianghua He']",SCConv: Spatial and Channel Reconstruction Convolution for Feature Redundancy.,CVPR,2023
442675,"['Yanghao Li', 'Haoqi Fan 0001', 'Ronghang Hu', 'Christoph Feichtenhofer', 'Kaiming He']",Scaling Language-Image Pre-Training via Masking.,CVPR,2023
442676,"['Xin Li', 'Tao Ma 0002', 'Yuenan Hou', 'Botian Shi', 'Yuchen Yang 0003', 'Youquan Liu', 'Xingjiao Wu', 'Qin Chen', 'Yikang Li', 'Yu Qiao 0001', 'Liang He 0001']",LoGoNet: Towards Accurate 3D Object Detection with Local-to-Global Cross- Modal Fusion.,CVPR,2023
442677,"['Wuyang Li', 'Jie Liu 0044', 'Bo Han', 'Yixuan Yuan']",Adjustment and Alignment for Unbiased Open Set Domain Adaptation.,CVPR,2023
442678,"['Siyuan Li', 'Tobias Fischer 0004', 'Lei Ke', 'Henghui Ding', 'Martin Danelljan', 'Fisher Yu 0001']",OVTrack: Open-Vocabulary Multiple Object Tracking.,CVPR,2023
442679,"['Wei Li', 'Jiahao Xie 0002', 'Chen Change Loy']",Correlational Image Modeling for Self-Supervised Visual Pre-Training.,CVPR,2023
442680,"['Yifan Li', 'Hu Han 0001', 'Shiguang Shan', 'Xilin Chen 0001']",DISC: Learning from Noisy Labels via Dynamic Instance-Specific Selection and Correction.,CVPR,2023
442681,"['Xingyi Li', 'Zhiguo Cao 0001', 'Huiqiang Sun', 'Jianming Zhang 0001', 'Ke Xian', 'Guosheng Lin']",3D Cinemagraphy from a Single Image.,CVPR,2023
442682,"['Yi Li', 'Kyle Min 0001', 'Subarna Tripathi', 'Nuno Vasconcelos']",SViTT: Temporal Learning of Sparse Video-Text Transformers.,CVPR,2023
442683,"['Senmao Li', 'Joost van de Weijer 0001', 'Yaxing Wang', 'Fahad Shahbaz Khan', 'Meiqin Liu', 'Jian Yang']",3D-Aware Multi-Class Image-to-Image Translation with NeRFs.,CVPR,2023
442684,"['Minghan Li 0001', 'Shuai Li 0014', 'Wangmeng Xiang', 'Lei Zhang 0006']",MDQE: Mining Discriminative Query Embeddings to Segment Occluded Instances on Challenging Videos.,CVPR,2023
442685,"['Feng Li 0040', 'Hao Zhang 0097', 'Huaizhe Xu', 'Shilong Liu', 'Lei Zhang 0001', 'Lionel M. Ni', 'Heung-Yeung Shum']",Mask DINO: Towards A Unified Transformer-based Framework for Object Detection and Segmentation.,CVPR,2023
442686,"['Yixuan Li', 'Chao Ma 0004', 'Yichao Yan', 'Wenhan Zhu', 'Xiaokang Yang']",3D-Aware Face Swapping.,CVPR,2023
442687,['Pengyu Li'],BioNet: A Biologically-Inspired Network for Face Recognition.,CVPR,2023
442688,"['Jialu Li', 'Mohit Bansal']",Improving Vision-and-Language Navigation by Generating Future-View Image Semantics.,CVPR,2023
442689,"['Kejie Li', 'Jia-Wang Bian', 'Robert Castle', 'Philip H. S. Torr', 'Victor Adrian Prisacariu']",MobileBrick: Building LEGO for 3D Reconstruction on Mobile Devices.,CVPR,2023
442690,"['Jiefeng Li', 'Siyuan Bian', 'Qi Liu', 'Jiasheng Tang', 'Fan Wang', 'Cewu Lu']",NIKI: Neural Inverse Kinematics with Invertible Neural Networks for 3D Human Pose and Shape Estimation.,CVPR,2023
442691,"['Weiyu Li', 'Xuelin Chen', 'Jue Wang 0001', 'Baoquan Chen']",Patch-Based 3D Natural Scene Generation from a Single Example.,CVPR,2023
442692,"['Guozhang Li', 'De Cheng', 'Xinpeng Ding', 'Nannan Wang 0001', 'Xiaoyu Wang 0002', 'Xinbo Gao 0001']",Boosting Weakly-Supervised Temporal Action Localization with Text Information.,CVPR,2023
442693,"['Jiacheng Li', 'Chang Chen', 'Wei Huang 0036', 'Zhiqiang Lang', 'Fenglong Song', 'Youliang Yan', 'Zhiwei Xiong']",Learning Steerable Function for Efficient Image Resampling.,CVPR,2023
442694,"['Jingyao Li', 'Pengguang Chen', 'Zexin He', 'Shaozuo Yu', 'Shu Liu 0005', 'Jiaya Jia']",Rethinking Out-of-distribution (OOD) Detection: Masked Image Modeling is All You Need.,CVPR,2023
442695,"['Tianhong Li', 'Huiwen Chang', 'Shlok Kumar Mishra', 'Han Zhang 0010', 'Dina Katabi', 'Dilip Krishnan']",MAGE: MAsked Generative Encoder to Unify Representation Learning and Image Synthesis.,CVPR,2023
442696,"['Xinglin Li', 'Jiajing Chen', 'Jinhui Ouyang', 'Hanhui Deng', 'Senem Velipasalar', 'Di Wu 0002']",ToThePoint: Efficient Contrastive Learning of 3D Point Clouds via Recycling.,CVPR,2023
442699,"['Xiaodan Li', 'Yuefeng Chen', 'Yao Zhu', 'Shuhui Wang', 'Rong Zhang', 'Hui Xue 0001']",ImageNet-E: Benchmarking Neural Network Robustness via Attribute Editing.,CVPR,2023
442700,"['Muheng Li', 'Yueqi Duan', 'Jie Zhou 0001', 'Jiwen Lu']",Diffusion-SDF: Text-to-Shape via Voxelized Diffusion.,CVPR,2023
442701,"['Jianan Li', 'Qiulei Dong']",Open-set Semantic Segmentation for Point Clouds via Adversarial Prototype Framework.,CVPR,2023
442702,"['Yuhan Li', 'Yishun Dou', 'Xuanhong Chen', 'Bingbing Ni', 'Yilin Sun', 'Yutian Liu', 'Fuzhen Wang']",Generalized Deep 3D Shape Prior via Part-Discretized Diffusion Process.,CVPR,2023
442703,"['Jiale Li', 'Hang Dai', 'Hao Han', 'Yong Ding 0003']",MSeg3D: Multi-Modal 3D Semantic Segmentation for Autonomous Driving.,CVPR,2023
442705,"['Zhiheng Li 0002', 'Ivan Evtimov', 'Albert Gordo', 'Caner Hazirbas', 'Tal Hassner', 'Cristian Canton-Ferrer', 'Chenliang Xu', 'Mark Ibrahim']",A Whac-A-Mole Dilemma: Shortcuts Come in Multiples Where Mitigating One Amplifies Others.,CVPR,2023
442706,"['Wenbin Li 0006', 'Zhichen Fan', 'Jing Huo', 'Yang Gao 0001']",Modeling Inter-Class and Intra-Class Constraints in Novel Class Discovery.,CVPR,2023
442707,"['Tianjiao Li', 'Lin Geng Foo', 'Ping Hu', 'Xindi Shang', 'Hossein Rahmani', 'Zehuan Yuan', 'Jun Liu 0036']",Token Boosting for Robust Self-Supervised Visual Transformer Pre-training.,CVPR,2023
442708,"['Qing Li 0032', 'Huifang Feng 0002', 'Kanle Shi', 'Yue Gao', 'Yi Fang 0006', 'Yu-Shen Liu', 'Zhizhong Han']",SHS-Net: Learning Signed Hyper Surfaces for Oriented Normal Estimation of Point Clouds.,CVPR,2023
442709,"['Yawei Li', 'Yuchen Fan', 'Xiaoyu Xiang', 'Denis Demandolx', 'Rakesh Ranjan', 'Radu Timofte', 'Luc Van Gool']",Efficient and Explicit Modelling of Image Hierarchies for Image Restoration.,CVPR,2023
442710,"['Hao Li', 'Charless C. Fowlkes', 'Hao Yang', 'Onkar Dabeer', 'Zhuowen Tu', 'Stefano Soatto']",Guided Recommendation for Model Fine-Tuning.,CVPR,2023
442711,"['Pu Li', 'Jianwei Guo', 'Xiaopeng Zhang 0001', 'Dong-Ming Yan 0001']",SECAD-Net: Self-Supervised CAD Reconstruction by Learning Sketch-Extrude Operations.,CVPR,2023
442712,"['Jingzhi Li 0004', 'Zidong Guo', 'Hui Li', 'Seungju Han', 'Ji-Won Baek', 'Min Yang', 'Ran Yang', 'Sungjoo Suh']",Rethinking Feature-based Knowledge Distillation for Face Recognition.,CVPR,2023
442713,"['Linjie Li', 'Zhe Gan', 'Kevin Lin', 'Chung-Ching Lin', 'Zicheng Liu 0001', 'Ce Liu 0001', 'Lijuan Wang']",LAVENDER: Unifying Video-Language Understanding as Masked Language Modeling.,CVPR,2023
442714,"['Xiang-Li Li', 'Meng-Hao Guo', 'Tai-Jiang Mu', 'Ralph R. Martin', 'Shi-Min Hu 0001']",Long Range Pooling for 3D Large-Scale Scene Understanding.,CVPR,2023
442715,"['Shanshan Li', 'Pan Gao', 'Xiaoyang Tan', 'Mingqiang Wei']",ProxyFormer: Proxy Alignment Assisted Point Cloud Completion with Missing Part Sensitive Transformer.,CVPR,2023
442716,"['Rui Li', 'Dong Gong', 'Wei Yin', 'Hao Chen', 'Yu Zhu 0004', 'Kaixuan Wang', 'Xiaozhi Chen', 'Jinqiu Sun', 'Yanning Zhang']",Learning to Fuse Monocular and Multi-view Cues for Multi-frame Depth Estimation in Dynamic Scenes.,CVPR,2023
442719,"['Hao Li', 'Xianxu Hou', 'Zepeng Huang', 'Linlin Shen']",StyleGene: Crossover and Mutation of Region-level Facial Genes for Kinship Face Synthesis.,CVPR,2023
442720,"['Qian Li', 'Yuxiao Hu', 'Ye Liu', 'Dongxiao Zhang', 'Xin Jin 0002', 'Yuntian Chen']",Discrete Point-Wise Attack is Not Enough: Generalized Manifold Adversarial Attack for Face Recognition.,CVPR,2023
442721,"['Ruihuang Li', 'Chenhang He', 'Shuai Li', 'Yabin Zhang 0001', 'Lei Zhang']",DynaMask: Dynamic Mask Selection for Instance Segmentation.,CVPR,2023
442722,"['Bonan Li', 'Yinhan Hu', 'Xuecheng Nie', 'Congying Han', 'Xiangjian Jiang', 'Tiande Guo', 'Luoqi Liu']",DropKey for Vision Transformer.,CVPR,2023
442723,"['Yu-Jhe Li', 'Shawn Hunt', 'Jinhyung Park', 'Matthew O&apos;Toole', 'Kris Kitani']",Azimuth Super-Resolution for FMCW Radar in Autonomous Driving.,CVPR,2023
442725,"['Weijia Li', 'Saihui Hou', 'Chunjie Zhang', 'Chunshui Cao', 'Xu Liu 0008', 'Yongzhen Huang', 'Yao Zhao']",An In-Depth Exploration of Person Re-Identification and Gait Recognition in Cloth-Changing Conditions.,CVPR,2023
442726,"['Ruihuang Li', 'Chenhang He', 'Yabin Zhang 0001', 'Shuai Li', 'Liyi Chen', 'Lei Zhang']",SIM: Semantic-aware Instance Mask Generation for Box-Supervised Instance Segmentation.,CVPR,2023
442727,"['Long Li', 'Junwei Han', 'Ni Zhang', 'Nian Liu', 'Salman H. Khan 0001', 'Hisham Cholakkal', 'Rao Muhammad Anwer', 'Fahad Shahbaz Khan']",Discriminative Co-Saliency and Background Mining Transformer for Co-Salient Object Detection.,CVPR,2023
442728,"['Haoyuan Li', 'Hao Jiang', 'Tao Jin', 'Mengyan Li', 'Yan Chen', 'Zhijie Lin', 'Yang Zhao', 'Zhou Zhao']",DATE: Domain Adaptive Product Seeker for E-Commerce.,CVPR,2023
442729,"['Gen Li', 'Jie Ji', 'Minghai Qin', 'Wei Niu 0002', 'Bin Ren', 'Fatemeh Afghah', 'Linke Guo', 'Xiaolong Ma']",Towards High-Quality and Efficient Video Super-Resolution via Spatial-Temporal Data Overfitting.,CVPR,2023
442731,"['Rui Li', 'Dong Liu 0002']",Spatial-then-Temporal Self-Supervised Learning for Video Correspondence.,CVPR,2023
442733,"['Yanjie Li', 'Yiquan Li', 'Xuelong Dai', 'Songtao Guo', 'Bin Xiao 0001']",Physical-World Optical Adversarial Attacks on 3D Face Recognition.,CVPR,2023
442734,"['Miaoyu Li', 'Ji Liu 0003', 'Ying Fu 0001', 'Yulun Zhang', 'Dejing Dou']",Spectral Enhanced Rectangle Transformer for Hyperspectral Image Denoising.,CVPR,2023
442735,"['Chuanhao Li', 'Zhen Li', 'Chenchen Jing', 'Yunde Jia', 'Yuwei Wu 0001']",Exploring the Effect of Primitives for Compositional Generalization in Vision-and-Language.,CVPR,2023
442736,"['Xin Li 0082', 'Bingchen Li', 'Xin Jin', 'Cuiling Lan', 'Zhibo Chen 0001']",Learning Distortion Invariant Representation for Image Restoration from a Causality Perspective.,CVPR,2023
442737,"['Jiahao Li', 'Bin Li 0012', 'Yan Lu 0001']",Neural Video Compression with Diverse Contexts.,CVPR,2023
442739,"['Shuai Li 0014', 'Minghan Li 0001', 'Ruihuang Li', 'Chenhang He', 'Lei Zhang 0006']",One-to-Few Label Assignment for End-to-End Dense Detection.,CVPR,2023
442740,"['Ming Li', 'Qingli Li', 'Yan Wang 0033']",Class Balanced Adaptive Pseudo Labeling for Federated Semi-Supervised Learning.,CVPR,2023
442741,"['Jiaman Li', 'C. Karen Liu', 'Jiajun Wu 0001']",Ego-Body Pose Estimation via Ego-Head Pose Estimation.,CVPR,2023
442742,"['Sicheng Li', 'Hao Li', 'Yue Wang 0020', 'Yiyi Liao', 'Lu Yu']",SteerNeRF: Accelerating NeRF Rendering via Smooth Viewpoint Trajectory.,CVPR,2023
442743,"['Leheng Li', 'Qing Lian', 'Luozhou Wang', 'Ningning Ma', 'Yingcong Chen']",Lift3D: Synthesize 3D Training Data by Lifting 2D GAN to 3D Generative Radiance Field.,CVPR,2023
442744,"['Yuheng Li', 'Haotian Liu', 'Qingyang Wu', 'Fangzhou Mu', 'Jianwei Yang', 'Jianfeng Gao 0001', 'Chunyuan Li', 'Yong Jae Lee']",GLIGEN: Open-Set Grounded Text-to-Image Generation.,CVPR,2023
521550,['Nisarg Shah 0001'],Pushing the Limits of Fairness in Algorithmic Decision-Making.,IJCAI,2023
521551,"['Hannah Kim 0002', 'Celia Cintas', 'Girmaw Abebe Tadesse', 'Skyler Speakman']",Spatially Constrained Adversarial Attack Detection and Localization in the Representation Space of Optical Flow Networks.,IJCAI,2023
521552,"['Arnab Bhattacharyya 0001', 'Sutanu Gayen', 'Kuldeep S. Meel', 'Dimitrios Myrisiotis', 'A. Pavan 0001', 'N. V. Vinodchandran']",On Approximating Total Variation Distance.,IJCAI,2023
521553,"['Ayumi Igarashi 0001', 'Yasushi Kawase', 'Warut Suksompong', 'Hanna Sumita']",Fair Division with Two-Sided Preferences.,IJCAI,2023
521554,"['Zhicheng He 0001', 'Weiwen Liu', 'Wei Guo 0006', 'Jiarui Qin', 'Yingxue Zhang 0001', 'Yaochen Hu 0001', 'Ruiming Tang']",A Survey on User Behavior Modeling in Recommender Systems.,IJCAI,2023
521555,"['Eugénio Ribeiro', 'Ricardo Ribeiro 0001', 'David Martins de Matos']",Automatic Recognition of the General-Purpose Communicative Functions Defined by the ISO 24617-2 Standard for Dialog Act Annotation (Extended Abstract).,IJCAI,2023
521556,"['Yuning Cui 0001', 'Yi Tao', 'Luoxi Jing', 'Alois Knoll']",Strip Attention for Image Restoration.,IJCAI,2023
521557,"['Haipeng Chen 0001', 'Bryan Wilder', 'Wei Qiu 0001', 'Bo An 0001', 'Eric Rice', 'Milind Tambe']",Complex Contagion Influence Maximization: A Reinforcement Learning Approach.,IJCAI,2023
521558,"['Xiaohan Yu 0001', 'Jun Wang 0121', 'Yongsheng Gao 0001']",CLE-ViT: Contrastive Learning Encoded Transformer for Ultra-Fine-Grained Visual Categorization.,IJCAI,2023
521559,"['Yongqiang Tian 0001', 'Zhenyang Xu', 'Yiwen Dong 0002', 'Chengnian Sun', 'Shing-Chi Cheung']",Revisiting the Evaluation of Deep Learning-Based Compiler Testing.,IJCAI,2023
521560,"['Junqiang Peng 0001', 'Mingyu Xiao 0001']",Fast Algorithms for SAT with Bounded Occurrences of Variables.,IJCAI,2023
521561,"['Ananya Joshi 0001', 'Kathryn Mazaitis', 'Roni Rosenfeld', 'Bryan Wilder']",Computationally Assisted Quality Control for Public Health Data Streams.,IJCAI,2023
521562,['Fabrizio Russo 0002'],Argumentation for Interactive Causal Discovery.,IJCAI,2023
521563,['Naman Shah 0002'],Reliable Neuro-Symbolic Abstractions for Planning and Learning.,IJCAI,2023
521564,"['Joachim Baumann 0002', 'Alessandro Castelnovo', 'Andrea Cosentini', 'Riccardo Crupi', 'Nicole Inverardi', 'Daniele Regoli']",Bias On Demand: Investigating Bias with a Synthetic Data Generator.,IJCAI,2023
521565,"['Guillaume Prévost 0002', 'Stéphane Cardon', 'Tristan Cazenave', 'Christophe Guettier', 'Éric Jacopin']",Topological Planning with Post-unique and Unary Actions.,IJCAI,2023
521566,"['Gang Chen 0002', 'Victoria Huang 0001']",Ensemble Reinforcement Learning in Continuous Spaces - A Hierarchical Multi-Step Approach for Policy Training.,IJCAI,2023
521567,"['Shubham Sharma 0002', 'Jette Henderson', 'Joydeep Ghosh']","FEAMOE: Fair, Explainable and Adaptive Mixture of Experts.",IJCAI,2023
521568,"['Yang Deng 0002', 'Wenqiang Lei', 'Wai Lam', 'Tat-Seng Chua']","A Survey on Proactive Dialogue Systems: Problems, Methods, and Prospects.",IJCAI,2023
521569,"['Radu Marinescu 0002', 'Haifeng Qian', 'Alexander G. Gray', 'Debarun Bhattacharjya', 'Francisco Barahona', 'Tian Gao', 'Ryan Riegel']",Approximate Inference in Logical Credal Networks.,IJCAI,2023
521570,"['Jing Ma 0002', 'Mengting Wan', 'Longqi Yang', 'Jundong Li', 'Brent J. Hecht', 'Jaime Teevan']",Learning Causal Effects on Hypergraphs (Extended Abstract).,IJCAI,2023
521571,"['Chao Bian 0002', 'Yawen Zhou', 'Miqing Li', 'Chao Qian 0001']",Stochastic Population Update Can Provably Be Helpful in Multi-Objective Evolutionary Algorithms.,IJCAI,2023
521572,"['Ziping Ma 0002', 'Yuesheng Zhu', 'Guibo Luo', 'Xiyao Liu 0001', 'Gerald Schaefer', 'Hui Fang 0003']",Robust Steganography without Embedding Based on Secure Container Synthesis and Iterative Message Recovery.,IJCAI,2023
521573,['Keisuke Okumura 0001'],Improving LaCAM for Scalable Eventually Optimal Multi-Agent Pathfinding.,IJCAI,2023
521574,"['Keisuke Okumura 0001', 'Xavier Défago']",Quick Multi-Robot Motion Planning by Combining Sampling and Search.,IJCAI,2023
521575,"['Lihui Qian 0003', 'Xintong Han', 'Faqiang Wang', 'Hongyu Liu', 'Haoye Dong', 'Zhiwen Li', 'Huawei Wei', 'Zhe Lin', 'Chengbin Jin']",XFormer: Fast and Accurate Monocular 3D Body Capture.,IJCAI,2023
521576,"['Yi Gao 0003', 'Miao Xu', 'Min-Ling Zhang']",Unbiased Risk Estimator to Multi-Labeled Complementary Label Learning.,IJCAI,2023
521577,"['Xinyu Fu 0004', 'Irwin King']",FedHGN: A Federated Framework for Heterogeneous Graph Neural Networks.,IJCAI,2023
521578,"['Haoming Li 0004', 'Xinzhuo Lin', 'Yang Zhou', 'Xiang Li', 'Yuchi Huo', 'Jiming Chen', 'Qi Ye']",Contact2Grasp: 3D Grasp Synthesis via Hand-Object Contact Constraint.,IJCAI,2023
521579,"['Trung Thanh Nguyen 0004', 'Jörg Rothe']",Complexity Results and Exact Algorithms for Fair Division of Indivisible Items: A Survey.,IJCAI,2023
521580,"['Peng Wang 0004', 'Jiafeng Xie', 'Xiye Chen', 'Guozheng Li', 'Wei Li']",PasCore: A Chinese Overlapping Relation Extraction Model Based on Global Pointer Annotation Strategy.,IJCAI,2023
521581,"['Tianle Wang 0006', 'Lianghao Xia', 'Chao Huang 0001']",Denoised Self-Augmented Learning for Social Recommendation.,IJCAI,2023
521582,"['Cuong Tran 0007', 'Ferdinando Fioretto']",On the Fairness Impacts of Private Ensembles Models.,IJCAI,2023
521583,"['Jeongho Kim 0007', 'Hanbeen Lee', 'Simon S. Woo']",IMF: Integrating Matched Features Using Attentive Logit in Knowledge Distillation.,IJCAI,2023
521584,"['Cuong Tran 0007', 'Keyu Zhu', 'Ferdinando Fioretto', 'Pascal Van Hentenryck']","SF-PATE: Scalable, Fair, and Private Aggregation of Teacher Ensembles.",IJCAI,2023
521585,"['Han Liu 0008', 'Xingshuo Huang', 'Xiaotong Zhang 0003', 'Qimai Li', 'Fenglong Ma', 'Wei Wang', 'Hongyang Chen', 'Hong Yu 0005', 'Xianchao Zhang 0001']",Boosting Decision-Based Black-Box Adversarial Attack with Gradient Priors.,IJCAI,2023
521586,"['Chen Xu 0008', 'Rong Ye', 'Qianqian Dong', 'Chengqi Zhao', 'Tom Ko', 'Mingxuan Wang', 'Tong Xiao', 'Jingbo Zhu']",Recent Advances in Direct Speech-to-text Translation.,IJCAI,2023
521587,"['Yifan Li 0009', 'Kun Zhou 0002', 'Wayne Xin Zhao', 'Ji-Rong Wen']",Diffusion Models for Non-autoregressive Text Generation: A Survey.,IJCAI,2023
521588,"['Qing Xu 0015', 'Min Wu 0008', 'Xiaoli Li 0001', 'Kezhi Mao', 'Zhenghua Chen']",Distilling Universal and Joint Knowledge for Cross-Domain Model Compression on Time Series Data.,IJCAI,2023
521589,"['Xu Yang 0019', 'Yanan Gu', 'Kun Wei', 'Cheng Deng']",Exploring Safety Supervision for Continual Test-time Domain Adaptation.,IJCAI,2023
521590,"['Bin Zhang 0052', 'Lijuan Li 0002', 'Zhiwei Xu 0005', 'Dapeng Li 0001', 'Guoliang Fan']",Inducing Stackelberg Equilibrium through Spatio-Temporal Sequential Decision-Making in Multi-Agent Reinforcement Learning.,IJCAI,2023
521591,"['Wei Zhang 0056', 'Yongxiang Liu', 'Zhuo Wang 0006', 'Jianyong Wang 0001']",Learning to Binarize Continuous Features for Neuro-Rule Networks.,IJCAI,2023
521592,"['Xin Li 0081', 'Deng Pan', 'Chengyin Li', 'Yao Qiang', 'Dongxiao Zhu']",Negative Flux Aggregation to Estimate Feature Attributions.,IJCAI,2023
521593,"['Santhini K. A.', 'Raghu Raman Ravi', 'Meghana Nasre']",Matchings under One-Sided Preferences with Soft Quotas.,IJCAI,2023
521594,"['Ibrahim Abdelaziz', 'Julian Dolby', 'Udayan Khurana', 'Horst Samulowitz', 'Kavitha Srinivas']",SemFORMS: Automatic Generation of Semantic Transforms By Mining Data Science Code.,IJCAI,2023
521595,"['Fatemeh Abdollahi', 'Saqib Ameen', 'Matthew E. Taylor', 'Levi H. S. Lelis']",Can You Improve My Code? Optimizing Programs with Local Search.,IJCAI,2023
521596,"['Kuruge Darshana Abeyrathna', 'Ahmed Abdulrahem Othman Abouzeid', 'Bimal Bhattarai', 'Charul Giri', 'Sondre Glimsdal', 'Ole-Christoffer Granmo', 'Lei Jiao 0001', 'Rupsa Saha', 'Jivitesh Sharma', 'Svein Anders Tunheim', 'Xuan Zhang 0007']",Building Concise Logical Patterns by Constraining Tsetlin Machine Clause Size.,IJCAI,2023
521597,"['Chamath Abeysinghe', 'Chris Reid', 'Hamid Rezatofighi', 'Bernd Meyer 0001']",Tracking Different Ant Species: An Unsupervised Domain Adaptation Framework and a Dataset for Multi-object Tracking.,IJCAI,2023
521598,"['Carlo Adornetto', 'Gianluigi Greco']",GIDnets: Generative Neural Networks for Solving Inverse Design Problems via Latent Space Exploration.,IJCAI,2023
521599,"['Emily L. Aiken', 'Esther Rolf', 'Joshua Blumenstock']",Fairness and Representation in Satellite-Based Poverty Maps: Evidence of Urban-Rural Disparities and Their Impacts on Downstream Policy.,IJCAI,2023
521600,"['Özgür Akgün', 'Alan M. Frisch', 'Ian P. Gent', 'Christopher Jefferson', 'Ian Miguel', 'Peter Nightingale']",Conjure: Automatic Generation of Constraint Models from Problem Specifications (Extended Abstract).,IJCAI,2023
521601,"['Yasmeena Akhter', 'Rishabh Ranjan', 'Richa Singh 0001', 'Mayank Vatsa', 'Santanu Chaudhury']",On AI-Assisted Pneumoconiosis Detection from Chest X-rays.,IJCAI,2023
521602,"['Hannaneh Akrami', 'Bhaskar Ray Chaudhury', 'Jugal Garg', 'Kurt Mehlhorn', 'Ruta Mehta']",Fair and Efficient Allocation of Indivisible Chores with Surplus.,IJCAI,2023
521603,"['Hannaneh Akrami', 'Jugal Garg', 'Eklavya Sharma', 'Setareh Taki']",Simplification and Improvement of MMS Approximation.,IJCAI,2023
521604,"['Gianvincenzo Alfano', 'Sergio Greco', 'Francesco Parisi', 'Irina Trubitsyna']",Preferences and Constraints in Abstract Argumentation.,IJCAI,2023
521605,['Shiri Alouf-Heffetz'],Using Liquid Democracy For Attention-Aware Social Choice.,IJCAI,2023
521606,"['Philipp Altmann', 'Fabian Ritz', 'Leonard Feuchtinger', 'Jonas Nüßlein', 'Claudia Linnhoff-Popien', 'Thomy Phan']",CROP: Towards Distributional-Shift Robust Reinforcement Learning Using Compact Reshaped Observation Processing.,IJCAI,2023
