item_id,authors,title,venue,year
554943,"['Bo Xue 0004', 'Yimu Wang', 'Yuanyu Wan', 'Jinfeng Yi', 'Lijun Zhang 0005']",Efficient Algorithms for Generalized Linear Bandits with Heavy-tailed Rewards.,NeurIPS,2023
554944,"['Lijun Zhang 0005', 'Peng Zhao 0006', 'Zhen-Hua Zhuang', 'Tianbao Yang', 'Zhi-Hua Zhou']",Stochastic Approximation Approaches to Group Distributionally Robust Optimization.,NeurIPS,2023
554945,"['Zhenyu Wang 0005', 'Ya-Li Li', 'Xi Chen', 'Hengshuang Zhao', 'Shengjin Wang']",Uni3DETR: Unified 3D Detection Transformer.,NeurIPS,2023
554946,"['Abhishek Singh 0005', 'Praneeth Vepakomma', 'Vivek Sharma 0001', 'Ramesh Raskar']",Posthoc privacy guarantees for collaborative inference with modified Propose-Test-Release.,NeurIPS,2023
554947,"['Tianyu Liu 0005', 'Yuge Wang', 'Rex Ying', 'Hongyu Zhao 0003']",MuSe-GNN: Learning Unified Gene Representation From Multimodal Biological Graph Data.,NeurIPS,2023
554948,"['Xiang Gu 0005', 'Liwei Yang', 'Jian Sun 0009', 'Zongben Xu']",Optimal Transport-Guided Conditional Score-Based Diffusion Model.,NeurIPS,2023
554949,"['Yu Pan 0005', 'Ye Yuan', 'Yichun Yin', 'Zenglin Xu', 'Lifeng Shang', 'Xin Jiang', 'Qun Liu']",Reusing Pretrained Models by Multi-linear Operators for Efficient Training.,NeurIPS,2023
554950,"['Gen Li 0005', 'Wenhao Zhan', 'Jason D. Lee', 'Yuejie Chi', 'Yuxin Chen 0002']",Reward-agnostic Fine-tuning: Provable Statistical Benefits of Hybrid Reinforcement Learning.,NeurIPS,2023
554951,"['Yichi Zhang 0006', 'Ankush Garg', 'Yuan Cao', 'Lukasz Lew', 'Behrooz Ghorbani', 'Zhiru Zhang', 'Orhan Firat']",Binarized Neural Machine Translation.,NeurIPS,2023
554952,"['Yixuan Zhang 0006', 'Quyu Kong', 'Feng Zhou 0011']",Integration-free Training for Spatio-temporal Multimodal Covariate Deep Kernel Point Processes.,NeurIPS,2023
554953,"['Xiao Ma 0006', 'Bingyi Kang', 'Zhongwen Xu', 'Min Lin', 'Shuicheng Yan']",Mutual Information Regularized Offline Reinforcement Learning.,NeurIPS,2023
554954,"['Lu Yin 0006', 'Gen Li', 'Meng Fang', 'Li Shen', 'Tianjin Huang', 'Zhangyang Wang', 'Vlado Menkovski', 'Xiaolong Ma', 'Mykola Pechenizkiy', 'Shiwei Liu']",Dynamic Sparsity Is Channel-Level Sparsity Learner.,NeurIPS,2023
554955,"['Ling Yang 0006', 'Jingwei Liu', 'Shenda Hong', 'Zhilong Zhang', 'Zhilin Huang', 'Zheming Cai', 'Wentao Zhang', 'Bin Cui 0001']",Improving Diffusion-Based Image Synthesis with Context Prediction.,NeurIPS,2023
554956,"['Zicheng Liu 0006', 'Siyuan Li', 'Ge Wang', 'Lirong Wu', 'Cheng Tan 0012', 'Stan Z. Li']",Harnessing Hard Mixed Samples with Decoupled Regularizer.,NeurIPS,2023
554957,"['Chen Liang 0006', 'Jiahui Yu', 'Ming-Hsuan Yang 0001', 'Matthew Brown', 'Yin Cui', 'Tuo Zhao', 'Boqing Gong', 'Tianyi Zhou 0002']",Module-wise Adaptive Distillation for Multimodality Foundation Models.,NeurIPS,2023
554958,"['Hao Hu 0006', 'Yiqin Yang', 'Jianing Ye', 'Ziqing Mai', 'Chongjie Zhang']",Unsupervised Behavior Extraction via Random Intent Priors.,NeurIPS,2023
554959,"['Yudi Zhang 0007', 'Yali Du 0001', 'Biwei Huang', 'Ziyan Wang', 'Jun Wang', 'Meng Fang', 'Mykola Pechenizkiy']",Interpretable Reward Redistribution in Reinforcement Learning: A Causal Approach.,NeurIPS,2023
554960,"['Xudong Wang 0007', 'Shufan Li', 'Konstantinos Kallidromitis', 'Yusuke Kato', 'Kazuki Kozuka', 'Trevor Darrell']",Hierarchical Open-vocabulary Universal Image Segmentation.,NeurIPS,2023
554961,"['Chen Sun 0007', 'Wannan Yang', 'Thomas Jiralerspong', 'Dane Malenfant', 'Benjamin Alsbury-Nealy', 'Yoshua Bengio', 'Blake A. Richards']",Contrastive Retrospection: honing in on critical steps for rapid learning and generalization in RL.,NeurIPS,2023
554962,"['Peng Cui 0007', 'Dan Zhang', 'Zhijie Deng', 'Yinpeng Dong', 'Jun Zhu 0001']",Learning Sample Difficulty from Pre-trained Models for Reliable Prediction.,NeurIPS,2023
554963,"['Zekun Li 0008', 'Shiyang Li', 'Xifeng Yan']",Time Series as Images: Vision Transformer for Irregularly Sampled Time Series.,NeurIPS,2023
554964,"['Han Liu 0008', 'Zhi Xu', 'Xiaotong Zhang 0003', 'Feng Zhang', 'Fenglong Ma', 'Hongyang Chen', 'Hong Yu 0005', 'Xianchao Zhang 0001']",HQA-Attack: Toward High Quality Black-Box Hard-Label Adversarial Attack on Text.,NeurIPS,2023
554965,"['Yifan Xu 0008', 'Mengdan Zhang', 'Chaoyou Fu', 'Peixian Chen', 'Xiaoshan Yang', 'Ke Li', 'Changsheng Xu']",Multi-modal Queried Object Detection in the Wild.,NeurIPS,2023
554966,"['Ziang Liu 0008', 'Genggeng Zhou', 'Jeff He', 'Tobia Marcucci', 'Fei-Fei Li 0001', 'Jiajun Wu 0001', 'Yunzhu Li']",Model-Based Control with Sparse Neural Dynamics.,NeurIPS,2023
554967,"['Yao Liu 0009', 'Pratik Chaudhari', 'Rasool Fakoor']",Budgeting Counterfactual for Offline RL.,NeurIPS,2023
554968,"['Zhaoxi Chen 0009', 'Fangzhou Hong', 'Haiyi Mei', 'Guangcong Wang', 'Lei Yang 0045', 'Ziwei Liu 0002']",PrimDiffusion: Volumetric Primitives Diffusion for 3D Human Generation.,NeurIPS,2023
554969,"['Wei Jin 0009', 'Haitao Mao', 'Zheng Li', 'Haoming Jiang', 'Chen Luo 0003', 'Hongzhi Wen', 'Haoyu Han', 'Hanqing Lu', 'Zhengyang Wang', 'Ruirui Li 0002', 'Zhen Li', 'Monica Xiao Cheng', 'Rahul Goutam', 'Haiyang Zhang', 'Karthik Subbian', 'Suhang Wang', 'Yizhou Sun', 'Jiliang Tang', 'Bing Yin', 'Xianfeng Tang']",Amazon-M2: A Multilingual Multi-locale Shopping Session Dataset for Recommendation and Text Generation.,NeurIPS,2023
554970,"['Jin Xu 0011', 'Emilien Dupont', 'Kaspar Märtens', 'Thomas Rainforth', 'Yee Whye Teh']",Deep Stochastic Processes via Functional Markov Transition Operators.,NeurIPS,2023
554971,"['Cheng Tan 0012', 'Siyuan Li', 'Zhangyang Gao', 'Wenfei Guan', 'Zedong Wang', 'Zicheng Liu 0006', 'Lirong Wu', 'Stan Z. Li']",OpenSTL: A Comprehensive Benchmark of Spatio-Temporal Predictive Learning.,NeurIPS,2023
554972,"['Shuo Chen 0014', 'Jindong Gu', 'Zhen Han', 'Yunpu Ma', 'Philip H. S. Torr', 'Volker Tresp']",Benchmarking Robustness of Adaptation Methods on Pre-trained Vision-Language Models.,NeurIPS,2023
554973,"['Cong Wang 0018', 'Jinshan Pan', 'Wei Wang 0335', 'Jiangxin Dong', 'Mengzhu Wang', 'Yakun Ju', 'Junyang Chen']",PromptRestorer: A Prompting Image Restoration Method with Degradation Perception.,NeurIPS,2023
554974,"['Di Wang 0023', 'Jing Zhang 0037', 'Bo Du 0001', 'Minqiang Xu', 'Lin Liu', 'Dacheng Tao', 'Liangpei Zhang 0001']",SAMRS: Scaling-up Remote Sensing Segmentation Dataset with Segment Anything Model.,NeurIPS,2023
554975,"['Qing Li 0032', 'Huifang Feng 0002', 'Kanle Shi', 'Yue Gao', 'Yi Fang', 'Yu-Shen Liu', 'Zhizhong Han']",NeuralGF: Unsupervised Point Normal Estimation by Learning Neural Gradient Function.,NeurIPS,2023
554976,"['Xiao Zhang 0034', 'Ninglu Shao', 'Zihua Si', 'Jun Xu 0001', 'Wenhan Wang', 'Hanjing Su', 'Ji-Rong Wen']",Reward Imputation with Sketching for Contextual Batched Bandits.,NeurIPS,2023
554977,"['Bo Li 0037', 'Fangxiao Wang', 'Yu Zhou 0047']",Fair Allocation of Indivisible Chores: Beyond Additive Costs.,NeurIPS,2023
554978,"['Kai Wang 0060', 'Fei Yang 0004', 'Shiqi Yang', 'Muhammad Atif Butt', 'Joost van de Weijer 0001']",Dynamic Prompt Learning: Addressing Cross-Attention Leakage for Text-Based Image Editing.,NeurIPS,2023
554979,"['Xin Liu 0034', 'Girish Narayanswamy', 'Akshay Paruchuri', 'Xiaoyu Zhang', 'Jiankai Tang', 'Yuzhe Zhang', 'Roni Sengupta', 'Shwetak N. Patel', 'Yuntao Wang 0001', 'Daniel McDuff']",rPPG-Toolbox: Deep Remote PPG Toolbox.,NeurIPS,2023
554980,"['Chen Chen 0075', 'Yuchen Hu', 'Chao-Han Huck Yang', 'Sabato Marco Siniscalchi', 'Pin-Yu Chen', 'Chng Eng Siong']",HyPoradise: An Open Baseline for Generative Speech Recognition with Large Language Models.,NeurIPS,2023
554981,"['Xin Li 0082', 'Dongze Lian', 'Zhihe Lu', 'Jiawang Bai', 'Zhibo Chen 0001', 'Xinchao Wang']",GraphAdapter: Tuning Vision-Language Models With Dual Knowledge Graph.,NeurIPS,2023
554982,"['Wei Chen 0124', 'Zichen Miao', 'Qiang Qiu']",Inner Product-based Neural Network Similarity.,NeurIPS,2023
554983,"['Anders Aamand', 'Justin Y. Chen', 'Allen Liu', 'Sandeep Silwal', 'Pattara Sukprasert', 'Ali Vakilian', 'Fred Zhang']",Constant Approximation for Individual Preference Stable Clustering.,NeurIPS,2023
554984,"['Anders Aamand', 'Justin Y. Chen', 'Huy Lê Nguyen', 'Sandeep Silwal', 'Ali Vakilian']",Improved Frequency Estimation Algorithms with and without Predictions.,NeurIPS,2023
554985,"['Amira Abbas', 'Robbie King', 'Hsin-Yuan Huang', 'William J. Huggins', 'Ramis Movassagh', 'Dar Gilboa', 'Jarrod R. McClean']","On quantum backpropagation, information reuse, and cheating measurement collapse.",NeurIPS,2023
554986,"['Emmanuel Abbe', 'Samy Bengio', 'Enric Boix-Adserà', 'Etai Littwin', 'Joshua M. Susskind']",Transformers learn through gradual rank increase.,NeurIPS,2023
554987,"['Emmanuel Abbe', 'Elisabetta Cornacchia', 'Aryo Lotfi']",Provable Advantage of Curriculum Learning on Parity Targets with Mixed Inputs.,NeurIPS,2023
554988,"['David Abel', 'André Barreto 0001', 'Benjamin Van Roy', 'Doina Precup', 'Hado Philip van Hasselt', 'Satinder Singh']",A Definition of Continual Reinforcement Learning.,NeurIPS,2023
554989,"['Jayadev Acharya', 'Clément L. Canonne', 'Ziteng Sun', 'Himanshu Tyagi']",Unified Lower Bounds for Interactive High-dimensional Estimation under Information Constraints.,NeurIPS,2023
554990,"['Sam Adam-Day', 'Theodor-Mihai Iliant', 'Ismail Ilkan Ceylan']",Zero-One Laws of Graph Neural Networks.,NeurIPS,2023
554991,"['Hammaad Adam', 'Fan Yin', 'Huibin Hu', 'Neil A. Tenenholtz', 'Lorin Crawford', 'Lester Mackey', 'Allison Koenecke']",Should I Stop or Should I Go: Early Stopping with Heterogeneous Populations.,NeurIPS,2023
554992,"['Saghar Adler', 'Vijay G. Subramanian']",Bayesian Learning of Optimal Policies in Markov Decision Processes with Countably Infinite State-Space.,NeurIPS,2023
554993,"['Urte Adomaityte', 'Gabriele Sicuro', 'Pierpaolo Vivo']",Classification of Heavy-tailed Features in High Dimensions: a Superstatistical Approach.,NeurIPS,2023
554994,"['Theo Adrai', 'Guy Ohayon', 'Michael Elad', 'Tomer Michaeli']",Deep Optimal Transport: A Practical Algorithm for Photo-realistic Image Restoration.,NeurIPS,2023
554995,"['Steven Adriaensen', 'Herilalaina Rakotoarison', 'Samuel Müller 0005', 'Frank Hutter']",Efficient Bayesian Learning Curve Extrapolation using Prior-Data Fitted Networks.,NeurIPS,2023
554996,"['Triantafyllos Afouras', 'Effrosyni Mavroudi', 'Tushar Nagarajan', 'Huiyu Wang', 'Lorenzo Torresani']",HT-Step: Aligning Instructional Articles with How-To Videos.,NeurIPS,2023
554997,"['Abhineet Agarwal', 'Anish Agarwal', 'Suhas Vijaykumar']",Synthetic Combinations: A Causal Inference Framework for Combinatorial Interventions.,NeurIPS,2023
554998,"['Siddhant Agarwal', 'Ishan Durugkar', 'Peter Stone', 'Amy Zhang']",f-Policy Gradients: A General Framework for Goal-Conditioned RL using f-Divergences.,NeurIPS,2023
554999,"['Anish Agarwal', 'Keegan Harris', 'Justin Whitehouse', 'Steven Z. Wu']",Adaptive Principal Component Regression with Applications to Panel Data.,NeurIPS,2023
555000,"['Haggai Agmon', 'Yoram Burak']",Simultaneous embedding of multiple attractor manifolds in a recurrent neural network using constrained gradient optimization.,NeurIPS,2023
555001,"['Lakshya A. Agrawal', 'Aditya Kanade', 'Navin Goyal', 'Shuvendu K. Lahiri', 'Sriram K. Rajamani']",Monitor-Guided Decoding of Code LMs with Static Analysis of Repository Context.,NeurIPS,2023
555002,"['Gustaf Ahdritz', 'Nazim Bouatta', 'Sachin Kadyan', 'Lukas Jarosch', 'Daniel Berenberg', 'Ian Fisk', 'Andrew M. Watkins', 'Stephen Ra', 'Richard Bonneau', 'Mohammed AlQuraishi']",OpenProteinSet: Training data for structural biology at scale.,NeurIPS,2023
555003,"['Arash Ahmadian', 'Saurabh Dash', 'Hongyu Chen', 'Bharat Venkitesh', 'Stephen Zhen Gou', 'Phil Blunsom', 'Ahmet Üstün', 'Sara Hooker']",Intriguing Properties of Quantization at Scale.,NeurIPS,2023
555004,"['Kareem Ahmed', 'Kai-Wei Chang', 'Guy Van den Broeck']",A Pseudo-Semantic Loss for Autoregressive Models with Logical Constraints.,NeurIPS,2023
555005,"['Kwangjun Ahn', 'Sébastien Bubeck', 'Sinho Chewi', 'Yin Tat Lee', 'Felipe Suarez', 'Yi Zhang']",Learning threshold neurons via edge of stability.,NeurIPS,2023
555006,"['Kwangjun Ahn', 'Xiang Cheng', 'Hadi Daneshmand', 'Suvrit Sra']",Transformers learn to implement preconditioned gradient descent for in-context learning.,NeurIPS,2023
555007,"['Kyusu Ahn', 'Byeonghyun Ko', 'HyunGyu Lee', 'Chanwoo Park', 'Jaejin Lee']",UDC-SIT: A Real-World Dataset for Under-Display Cameras.,NeurIPS,2023
555008,"['Anurag Ajay', 'Seungwook Han', 'Yilun Du', 'Shuang Li', 'Abhi Gupta', 'Tommi S. Jaakkola', 'Joshua B. Tenenbaum', 'Leslie Pack Kaelbling', 'Akash Srivastava', 'Pulkit Agrawal 0001']",Compositional Foundation Models for Hierarchical Planning.,NeurIPS,2023
555009,"['Sina Akbari', 'Fateme Jamshidi', 'Ehsan Mokhtarian', 'Matthew J. Vowels', 'Jalal Etesami', 'Negar Kiyavash']",Causal Effect Identification in Uncertain Causal Networks.,NeurIPS,2023
555010,"['Hassan Akbari', 'Dan Kondratyuk', 'Yin Cui', 'Rachel Hornung', 'Huisheng Wang', 'Hartwig Adam']",Alternating Gradient Descent and Mixture-of-Experts for Integrated Multimodal Perception.,NeurIPS,2023
555011,"['Amir Akbarnejad', 'Gilbert Bigras', 'Nilanjan Ray']","GPEX, A Framework For Interpreting Artificial Neural Networks.",NeurIPS,2023
555012,"['Sai Aparna Aketi', 'Abolfazl Hashemi', 'Kaushik Roy 0001']",Global Update Tracking: A Decentralized Learning Algorithm for Heterogeneous Data.,NeurIPS,2023
555013,"['Tara Akhound-Sadegh', 'Laurence Perreault Levasseur', 'Johannes Brandstetter', 'Max Welling', 'Siamak Ravanbakhsh']",Lie Point Symmetry and Physics-Informed Networks.,NeurIPS,2023
555014,"['Hannaneh Akrami', 'Kurt Mehlhorn', 'Masoud Seddighin', 'Golnoosh Shahkarami']",Randomized and Deterministic Maximin-share Approximations for Fractionally Subadditive Valuations.,NeurIPS,2023
555015,"['Ahmed M. Alaa', 'Zaid Ahmad', 'Mark J. van der Laan']",Conformal Meta-learners for Predictive Inference of Individual Treatment Effects.,NeurIPS,2023
555016,"['Ibrahim M. Alabdulmohsin', 'Xiaohua Zhai', 'Alexander Kolesnikov 0003', 'Lucas Beyer']",Getting ViT in Shape: Scaling Laws for Compute-Optimal Model Design.,NeurIPS,2023
555017,"['Alon Albalak', 'Colin A. Raffel', 'William Yang Wang']",Improving Few-Shot Generalization by Exploring and Exploiting Auxiliary Data.,NeurIPS,2023
555018,"['Lucas Nunes Alegre', 'Ana L. C. Bazzan', 'Ann Nowé', 'Bruno C. da Silva 0001']",Multi-Step Generalized Policy Improvement by Leveraging Approximate Models.,NeurIPS,2023
555019,"['Yotam Alexander', 'Nimrod De La Vega', 'Noam Razin', 'Nadav Cohen']",What Makes Data Suitable for a Locally Connected Neural Network? A Necessary and Sufficient Condition Based on Quantum Entanglement.,NeurIPS,2023
555020,"['Carlo Alfano', 'Rui Yuan', 'Patrick Rebeschini']",A Novel Framework for Policy Mirror Descent with General Parameterization and Linear Convergence.,NeurIPS,2023
555021,"['Muhammad Salman Ali', 'Yeongwoong Kim', 'Maryam Qamar', 'Sung-Chang Lim', 'Donghyun Kim', 'Chaoning Zhang', 'Sung-Ho Bae', 'Hui Yong Kim']",Towards Efficient Image Compression Without Autoregressive Models.,NeurIPS,2023
555022,"['Maryam Aliakbarpour', 'Mark Bun', 'Adam Smith']",Hypothesis Selection with Memory Constraints.,NeurIPS,2023
555023,"['Robert Allison', 'Anthony Stephenson', 'Samuel F', 'Edward O. Pyzer-Knapp']",Leveraging Locality and Robustness to Achieve Massively Scalable Gaussian Process Regression.,NeurIPS,2023
555024,"['Youssef Allouah', 'Rachid Guerraoui', 'Nirupam Gupta', 'Rafael Pinot', 'Geovani Rizk']",Robust Distributed Learning: Tight Error Bounds and Breakdown Point under Data Heterogeneity.,NeurIPS,2023
555025,"['Josh Alman', 'Zhao Song 0002']",Fast Attention Requires Bounded Entries.,NeurIPS,2023
555026,"['Josh Alman', 'Jiehao Liang', 'Zhao Song 0002', 'Ruizhe Zhang 0001', 'Danyang Zhuo']",Bypass Exponential Time Preprocessing: Fast Neural Network Training via Weight-Data Correlation Preprocessing.,NeurIPS,2023
555027,"['Abdullah Alomar', 'Munther A. Dahleh', 'Sean Mann', 'Devavrat Shah']",SAMoSSA: Multivariate Singular Spectrum Analysis with Stochastic Autoregressive Noise.,NeurIPS,2023
555028,"['Morris Alper', 'Hadar Averbuch-Elor']",Kiki or Bouba? Sound Symbolism in Vision-and-Language Models.,NeurIPS,2023
555029,"['Erik R. Altman', 'Jovan Blanusa', 'Luc von Niederhäusern', 'Beni Egressy', 'Andreea Anghel', 'Kubilay Atasu']",Realistic Synthetic Financial Transactions for Anti-Money Laundering Models.,NeurIPS,2023
555030,"['Rohan Alur', 'Loren Laine', 'Darrick K. Li', 'Manish Raghavan', 'Devavrat Shah', 'Dennis L. Shung']",Auditing for Human Expertise.,NeurIPS,2023
555031,"['Verónica Álvarez', 'Santiago Mazuelas', 'Jose A. Lozano']",Minimax Forward and Backward Learning of Evolving Tasks with Performance Guarantees.,NeurIPS,2023
555032,"['Matheus Aparecido do Carmo Alves', 'Amokh Varma', 'Yehia Elkhatib', 'Leandro Soriano Marcolino']",Information-guided Planning: An Online Approach for Partially Observable Problems.,NeurIPS,2023
555033,"['Suresh Kumar Amalapuram', 'Sumohana S. Channappayya', 'Bheemarjuna Reddy Tamma']",Augmented Memory Replay-based Continual Learning Approaches for Network Intrusion Detection.,NeurIPS,2023
555034,"['Sebastian Ament', 'Samuel Daulton', 'David Eriksson', 'Maximilian Balandat', 'Eytan Bakshy']",Unexpected Improvements to Expected Improvement for Bayesian Optimization.,NeurIPS,2023
555035,"['Afra Amini', 'Li Du', 'Ryan Cotterell']",Structured Voronoi Sampling.,NeurIPS,2023
555036,"['Tal Amir', 'Steven J. Gortler', 'Ilai Avni', 'Ravina Ravina', 'Nadav Dym']","Neural Injective Functions for Multisets, Measures and Graphs via a Finite Witness Theorem.",NeurIPS,2023
555037,"['SeungHwan An', 'Jong-June Jeon']",Distributional Learning of Variational AutoEncoder: Application to Synthetic Data Generation.,NeurIPS,2023
555038,"['Gaon An', 'Junhyeok Lee', 'Xingdong Zuo', 'Norio Kosaka', 'Kyung-Min Kim', 'Hyun Oh Song']",Direct Preference-based Policy Optimization without Reward Modeling.,NeurIPS,2023
555039,"['Xuming An', 'Li Shen 0008', 'Han Hu 0003', 'Yong Luo 0002']",Federated Learning with Manifold Regularization and Normalized Update Reaggregation.,NeurIPS,2023
555040,"['Guoyuan An', 'Ju-hyeong Seon', 'Inkyu An', 'Yuchi Huo', 'Sung-eui Yoon']",Topological RANSAC for instance verification and retrieval without fine-tuning.,NeurIPS,2023
555041,"['Vuong Dinh An', 'Minh Nhat Vu', 'Toan Nguyen', 'Baoru Huang', 'Dzung Nguyen', 'Thieu Vo', 'Anh Nguyen 0003']",Language-driven Scene Synthesis using Multi-conditional Diffusion Model.,NeurIPS,2023
555042,"['Bang An', 'Xun Zhou', 'Yongjian Zhong', 'Tianbao Yang']",SpatialRank: Urban Event Ranking with NDCG Optimization on Spatiotemporal Data.,NeurIPS,2023
555043,"['Ioannis Anagnostides', 'Ioannis Panageas', 'Gabriele Farina', 'Tuomas Sandholm']",On the Convergence of No-Regret Learning Dynamics in Time-Varying Games.,NeurIPS,2023
555044,"['Ioannis Anagnostides', 'Tuomas Sandholm']",On the Interplay between Social Welfare and Tractability of Equilibria.,NeurIPS,2023
555045,"['Sotiris Anagnostidis', 'Dario Pavllo', 'Luca Biggio', 'Lorenzo Noci', 'Aurélien Lucchi', 'Thomas Hofmann']",Dynamic Context Pruning for Efficient and Interpretable Autoregressive Transformers.,NeurIPS,2023
555046,"['Nishanth Anand', 'Doina Precup']",Prediction and Control in Continual Reinforcement Learning.,NeurIPS,2023
555047,"['Joel Daniel Andersson', 'Rasmus Pagh']",A Smooth Binary Mechanism for Efficient Private Continual Observation.,NeurIPS,2023
555048,"['Alexandr Andoni', 'Piotr Indyk', 'Sepideh Mahabadi', 'Shyam Narayanan']",Differentially Private Approximate Near Neighbor Counting in High Dimensions.,NeurIPS,2023
555049,"['Bryan Andrews', 'Joseph D. Ramsey', 'Ruben Sanchez-Romero', 'Jazmin Camchong', 'Erich Kummerfeld']",Fast Scalable and Accurate Discovery of DAGs Using the Best Order Score Search and Grow Shrink Trees.,NeurIPS,2023
555050,"['Jerone Theodore Alexander Andrews', 'Dora Zhao', 'William Thong', 'Apostolos Modas', 'Orestis Papakyriakopoulos', 'Alice Xiang']",Ethical Considerations for Responsible Data Curation.,NeurIPS,2023
555051,"['Maksym Andriushchenko', 'Dara Bahri', 'Hossein Mobahi', 'Nicolas Flammarion']",Sharpness-Aware Minimization Leads to Low-Rank Features.,NeurIPS,2023
555052,"['Anastasios Angelopoulos', 'Emmanuel J. Candès', 'Ryan J. Tibshirani']",Conformal PID Control for Time Series Prediction.,NeurIPS,2023
555053,"['Yashas Annadani', 'Nick Pawlowski', 'Joel Jennings', 'Stefan Bauer', 'Cheng Zhang 0005', 'Wenbo Gong 0001']",BayesDAG: Gradient-Based Posterior Inference for Causal Discovery.,NeurIPS,2023
555054,"['Jacy Reese Anthis', 'Victor Veitch']",Causal Context Connects Counterfactual Fairness to Robust Prediction and Group Fairness.,NeurIPS,2023
555055,"['Richard Antonello', 'Aditya R. Vaidya', 'Alexander Huth']",Scaling laws for language encoding models in fMRI.,NeurIPS,2023
555056,"['Erik Arakelyan', 'Pasquale Minervini', 'Daniel Daza', 'Michael Cochez', 'Isabelle Augenstein']",Adapting Neural Link Predictors for Data-Efficient Complex Query Answering.,NeurIPS,2023
555057,"['Michael Arbel', 'Romain Menegaux', 'Pierre Wolinski']",Rethinking Gauss-Newton for learning over-parameterized models.,NeurIPS,2023
555058,"['Lora Aroyo', 'Alex S. Taylor', 'Mark Díaz', 'Christopher Homan', 'Alicia Parrish', 'Gregory Serapio-García', 'Vinodkumar Prabhakaran', 'Ding Wang']",DICES Dataset: Diversity in Conversational AI Evaluation for Safety.,NeurIPS,2023
555059,"['Srinivasan Arunachalam', 'Vojtech Havlícek', 'Louis Schatzki']",On the Role of Entanglement and Statistics in Learning.,NeurIPS,2023
555060,"['Kavosh Asadi', 'Rasool Fakoor', 'Shoham Sabach']",Resetting the Optimizer in Deep RL: An Empirical Study.,NeurIPS,2023
555061,"['Kavosh Asadi', 'Shoham Sabach', 'Yao Liu 0009', 'Omer Gottesman', 'Rasool Fakoor']",TD Convergence: An Optimization Perspective.,NeurIPS,2023
555062,"['Elliott Ash', 'Naman Goel', 'Nianyun Li', 'Claudia Marangon', 'Peiyao Sun']",WCLD: Curated Large Dataset of Criminal Cases from Wisconsin Circuit Courts.,NeurIPS,2023
555063,"['Kumar Ashutosh', 'Santhosh Kumar Ramakrishnan', 'Triantafyllos Afouras', 'Kristen Grauman']",Video-Mined Task Graphs for Keystep Recognition in Instructional Videos.,NeurIPS,2023
555064,"['Hilal Asi', 'Vitaly Feldman', 'Jelani Nelson', 'Huy L. Nguyen', 'Kunal Talwar']",Fast Optimal Locally Private Mean Estimation via Random Projections.,NeurIPS,2023
555065,"['Vishal Asnani', 'Abhinav Kumar 0004', 'Suya You', 'Xiaoming Liu 0002']",PrObeD: Proactive Object Detection Wrapper.,NeurIPS,2023
555066,"['Sepehr Assadi', 'Vihan Shah', 'Chen Wang']",Streaming Algorithms and Lower Bounds for Estimating Correlation Clustering Cost.,NeurIPS,2023
555067,"['Hugues Van Assel', 'Titouan Vayer', 'Rémi Flamary', 'Nicolas Courty']",SNEkhorn: Dimension Reduction with Symmetric Entropic Affinities.,NeurIPS,2023
555068,"['Lazar Atanackovic', 'Alexander Tong 0001', 'Bo Wang', 'Leo J. Lee', 'Yoshua Bengio', 'Jason S. Hartford']",DynGFN: Towards Bayesian Inference of Gene Regulatory Networks with GFlowNets.,NeurIPS,2023
555069,"['Alexia Atsidakou', 'Branislav Kveton', 'Sumeet Katariya', 'Constantine Caramanis', 'Sujay Sanghavi']",Logarithmic Bayes Regret Bounds.,NeurIPS,2023
555070,"['Souhaib Attaiki', 'Maks Ovsjanikov']",Shape Non-rigid Kinematics (SNK): A Zero-Shot Method for Non-Rigid Shape Matching via Unsupervised Functional Map Regularized Reconstruction.,NeurIPS,2023
555071,"['Idan Attias', 'Steve Hanneke', 'Alkis Kalavasis', 'Amin Karbasi', 'Grigoris Velegkas']",Optimal Learners for Realizable Regression: PAC Learning and Online Learning.,NeurIPS,2023
555072,"['Andreas Auer', 'Martin Gauch', 'Daniel Klotz', 'Sepp Hochreiter']",Conformal Prediction for Time Series with Modern Hopfield Networks.,NeurIPS,2023
555073,"['Lukasz Augustyniak', 'Szymon Wozniak', 'Marcin Gruza', 'Piotr Gramacki', 'Krzysztof Rajda', 'Mikolaj Morzy', 'Tomasz Kajdanowicz']",Massively Multilingual Corpus of Sentiment Datasets and Multi-faceted Sentiment Classification Benchmark.,NeurIPS,2023
555074,"['Ilze Amanda Auzina', 'Çagatay Yildiz', 'Sara Magliacane', 'Matthias Bethge', 'Efstratios Gavves']",Modulated Neural ODEs.,NeurIPS,2023
555075,"['Marco Aversa', 'Gabriel Nobis', 'Miriam Hägele', 'Kai Standvoss', 'Mihaela Chirica', 'Roderick Murray-Smith', 'Ahmed M. Alaa', 'Lukas Ruff', 'Daniela Ivanova', 'Wojciech Samek', 'Frederick Klauschen', 'Bruno Sanguinetti', 'Luis Oala']",DiffInfinite: Large Mask-Image Synthesis via Parallel Random Patch Diffusion in Histopathology.,NeurIPS,2023
555076,"['Görkay Aydemir', 'Weidi Xie', 'Fatma Güney']",Self-supervised Object-Centric Learning for Videos.,NeurIPS,2023
555077,"['Sarp Aykent', 'Tian Xia 0006']",SaVeNet: A Scalable Vector Network for Enhanced Molecular Representation Learning.,NeurIPS,2023
555078,"['Mehdi Azabou', 'Vinam Arora', 'Venkataramana Ganesh', 'Ximeng Mao', 'Santosh Nachimuthu', 'Michael Mendelson', 'Blake A. Richards', 'Matthew G. Perich', 'Guillaume Lajoie', 'Eva L. Dyer']","A Unified, Scalable Framework for Neural Population Decoding.",NeurIPS,2023
555079,"['Mehdi Azabou', 'Michael Mendelson', 'Nauman Ahad', 'Maks Sorokin', 'Shantanu Thakoor', 'Carolina Urzay', 'Eva L. Dyer']","Relax, it doesn&apos;t matter how you get there: A new self-supervised approach for multi-timescale behavior analysis.",NeurIPS,2023
555080,"['Yossi Azar', 'Debmalya Panigrahi', 'Noam Touitou']",Discrete-Smoothness in Online Algorithms with Predictions.,NeurIPS,2023
555081,"['Achraf Azize', 'Marc Jourdan', 'Aymen Al Marjani', 'Debabrota Basu']",On the Complexity of Differentially Private Best-Arm Identification with Fixed Confidence.,NeurIPS,2023
555082,"['Waïss Azizian', 'Franck Iutzeler', 'Jérôme Malick']",Exact Generalization Guarantees for (Regularized) Wasserstein Distributionally Robust Models.,NeurIPS,2023
555083,"['Abdellah Aznag', 'Rachel Cummings', 'Adam N. Elmachtoub']",An active learning framework for multi-group mean estimation.,NeurIPS,2023
